22,python,3,Download Python | Python.org,Python was created in the early 1990s by Guido van Rossum at Stichting Mathematisch Centrum in the Netherlands as a successor of a language called ABC. Guido ...,www.python.org,https://www.python.org/downloads/,2022-09-01 16:26:08.646337+00:00,1340000000,mKMOugLFVo8J,10,desss,a283296b1cb8147fd,,1.11,"1,340,000,000",https://www.python.org/downloads/,https://www.<b>python</b>.org/downloads/,<b>Python</b> was created in the early 1990s by Guido van Rossum at Stichting Mathematisch Centrum in the Netherlands as a successor of a language called ABC. Guido&nbsp;...,Download <b>Python</b> | <b>Python</b>.org,utf8,customsearch#result,,utf8,"{'cse_thumbnail': [{'src': 'https://encrypted-tbn1.gstatic.com/images?q=tbn:ANd9GcT-wRuWdLHQDV50Bvs30LBfvbDRoaXHxbiZ1CXFrsMnEPMz94ccOmx8z5xE', 'width': '200', 'height': '200'}], 'metatags': [{'application-name': 'Python.org', 'msapplication-tilecolor': '#3673a5', 'og:image': 'https://www.python.org/static/opengraph-icon-200x200.png', 'og:type': 'website', 'og:site_name': 'Python.org', 'handheldfriendly': 'True', 'msapplication-tooltip': 'The official home of the Python Programming Language', 'apple-mobile-web-app-title': 'Python.org', 'og:title': 'Download Python', 'msapplication-tileimage': '/static/metro-icon-144x144-precomposed.png', 'msapplication-navbutton-color': '#3673a5', 'og:description': 'The official home of the Python Programming Language', 'og:image:secure_url': 'https://www.python.org/static/opengraph-icon-200x200.png', 'apple-mobile-web-app-status-bar-style': 'black', 'viewport': 'width=device-width, initial-scale=1.0', 'apple-mobile-web-app-capable': 'yes', 'og:url': 'https://www.python.org/downloads/', 'format-detection': 'telephone=no'}], 'cse_image': [{'src': 'https://www.python.org/static/opengraph-icon-200x200.png'}]}",off,1.109379,1,"[{'src': 'https://encrypted-tbn1.gstatic.com/images?q=tbn:ANd9GcT-wRuWdLHQDV50Bvs30LBfvbDRoaXHxbiZ1CXFrsMnEPMz94ccOmx8z5xE', 'width': '200', 'height': '200'}]","[{'application-name': 'Python.org', 'msapplication-tilecolor': '#3673a5', 'og:image': 'https://www.python.org/static/opengraph-icon-200x200.png', 'og:type': 'website', 'og:site_name': 'Python.org', 'handheldfriendly': 'True', 'msapplication-tooltip': 'The official home of the Python Programming Language', 'apple-mobile-web-app-title': 'Python.org', 'og:title': 'Download Python', 'msapplication-tileimage': '/static/metro-icon-144x144-precomposed.png', 'msapplication-navbutton-color': '#3673a5', 'og:description': 'The official home of the Python Programming Language', 'og:image:secure_url': 'https://www.python.org/static/opengraph-icon-200x200.png', 'apple-mobile-web-app-status-bar-style': 'black', 'viewport': 'width=device-width, initial-scale=1.0', 'apple-mobile-web-app-capable': 'yes', 'og:url': 'https://www.python.org/downloads/', 'format-detection': 'telephone=no'}]",[{'src': 'https://www.python.org/static/opengraph-icon-200x200.png'}],,,,,,,,,,,,,,,"width=device-width, initial-scale=1.0",,https://www.python.org/static/opengraph-icon-200x200.png,website,,,,Download Python,,,,,The official home of the Python Programming Language,,,,,,https://www.python.org/downloads/,,#3673a5,,,,,,,,,black,,,,Python.org,,https://www.python.org/static/opengraph-icon-200x200.png,,,,,,,,,,,,,,,Python.org,,,True,,,,/static/metro-icon-144x144-precomposed.png,,,,,,,,,,telephone=no,,,,,,,,,,,,,,,,,,,,,,,,,,,,,,,Python.org,The official home of the Python Programming Language,#3673a5,yes,,,,,,,,,,,,,,,,,,,,,,,,,,,,,,,,,,
23,python,4,The Python Tutorial — Python 3.10.6 documentation,"Python is an easy to learn, powerful programming language. It has efficient high-level data structures and a simple but effective approach to ...",docs.python.org,https://docs.python.org/3/tutorial/,2022-09-01 16:26:08.646337+00:00,1340000000,FcZ5ySfi_xYJ,10,desss,a283296b1cb8147fd,,1.11,"1,340,000,000",https://docs.python.org/3/tutorial/,https://docs.<b>python</b>.org/3/tutorial/,"<b>Python</b> is an easy to learn, powerful programming language. It has efficient high-level data structures and a simple but effective approach to&nbsp;...",The <b>Python</b> Tutorial — <b>Python</b> 3.10.6 documentation,utf8,customsearch#result,,utf8,"{'metatags': [{'viewport': 'width=device-width, initial-scale=1.0'}]}",off,1.109379,1,,"[{'viewport': 'width=device-width, initial-scale=1.0'}]",,,,,,,,,,,,,,,,"width=device-width, initial-scale=1.0",,,,,,,,,,,,,,,,,,,,,,,,,,,,,,,,,,,,,,,,,,,,,,,,,,,,,,,,,,,,,,,,,,,,,,,,,,,,,,,,,,,,,,,,,,,,,,,,,,,,,,,,,,,,,,,,,,,,,,,,,,,,,,,,,,,,,,,
24,python,5,Python (programming language) - Wikipedia,"Python is dynamically-typed and garbage-collected. It supports multiple programming paradigms, including structured (particularly procedural), object-oriented ...",en.wikipedia.org,https://en.wikipedia.org/wiki/Python_(programming_language),2022-09-01 16:26:08.646337+00:00,1340000000,3wRBXLyvECcJ,10,desss,a283296b1cb8147fd,,1.11,"1,340,000,000",https://en.wikipedia.org/wiki/Python_(programming_language),https://en.wikipedia.org/wiki/<b>Python</b>_(programming_language),"<b>Python</b> is dynamically-typed and garbage-collected. It supports multiple programming paradigms, including structured (particularly procedural), object-oriented&nbsp;...",<b>Python</b> (programming language) - Wikipedia,utf8,customsearch#result,,utf8,"{'cse_thumbnail': [{'src': 'https://encrypted-tbn3.gstatic.com/images?q=tbn:ANd9GcQAICLnziE51vzwsEZDrpG-bSYQ9K7BhHrrKdsi-mPNpaEvXAX7eqC4YJlJ', 'width': '214', 'height': '235'}], 'metatags': [{'referrer': 'origin', 'og:image': 'https://upload.wikimedia.org/wikipedia/commons/thumb/c/c3/Python-logo-notext.svg/1200px-Python-logo-notext.svg.png', 'theme-color': '#eaecf0', 'og:image:width': '1200', 'og:type': 'website', 'viewport': 'width=device-width, initial-scale=1.0, user-scalable=yes, minimum-scale=0.25, maximum-scale=5.0', 'og:title': 'Python (programming language) - Wikipedia', 'og:image:height': '1315', 'format-detection': 'telephone=no'}], 'cse_image': [{'src': 'https://upload.wikimedia.org/wikipedia/commons/thumb/c/c3/Python-logo-notext.svg/1200px-Python-logo-notext.svg.png'}]}",off,1.109379,1,"[{'src': 'https://encrypted-tbn3.gstatic.com/images?q=tbn:ANd9GcQAICLnziE51vzwsEZDrpG-bSYQ9K7BhHrrKdsi-mPNpaEvXAX7eqC4YJlJ', 'width': '214', 'height': '235'}]","[{'referrer': 'origin', 'og:image': 'https://upload.wikimedia.org/wikipedia/commons/thumb/c/c3/Python-logo-notext.svg/1200px-Python-logo-notext.svg.png', 'theme-color': '#eaecf0', 'og:image:width': '1200', 'og:type': 'website', 'viewport': 'width=device-width, initial-scale=1.0, user-scalable=yes, minimum-scale=0.25, maximum-scale=5.0', 'og:title': 'Python (programming language) - Wikipedia', 'og:image:height': '1315', 'format-detection': 'telephone=no'}]",[{'src': 'https://upload.wikimedia.org/wikipedia/commons/thumb/c/c3/Python-logo-notext.svg/1200px-Python-logo-notext.svg.png'}],,,,,,,,,,,,,,,"width=device-width, initial-scale=1.0, user-scalable=yes, minimum-scale=0.25, maximum-scale=5.0",,https://upload.wikimedia.org/wikipedia/commons/thumb/c/c3/Python-logo-notext.svg/1200px-Python-logo-notext.svg.png,website,,,,Python (programming language) - Wikipedia,,,,,,,,,,,,,,#eaecf0,,,,,,,,,,,1200,,1315,,,,,,,,,,,,,,,,,,,,,,,,,,,,,,,,origin,telephone=no,,,,,,,,,,,,,,,,,,,,,,,,,,,,,,,,,,,,,,,,,,,,,,,,,,,,,,,,,,,,,,,,,,,,
25,python,6,Python Courses & Tutorials | Codecademy,"Python is a general-purpose, versatile, and powerful programming language. It's a great first language because it's concise and easy to read.",www.codecademy.com,https://www.codecademy.com/catalog/language/python,2022-09-01 16:26:08.646337+00:00,1340000000,AJ2qJ46y8nQJ,10,desss,a283296b1cb8147fd,,1.11,"1,340,000,000",https://www.codecademy.com/catalog/language/python,https://www.codecademy.com/catalog/language/<b>python</b>,"<b>Python</b> is a general-purpose, versatile, and powerful programming language. It&#39;s a great first language because it&#39;s concise and easy to read.",<b>Python</b> Courses &amp; Tutorials | Codecademy,utf8,customsearch#result,,utf8,"{'cse_thumbnail': [{'src': 'https://encrypted-tbn2.gstatic.com/images?q=tbn:ANd9GcSeSIzcQrS7QZR5tfWx0hp68RbiAbhL4M6L3ex3chvuPb_xApS7BXx19h5w', 'width': '310', 'height': '163'}], 'metatags': [{'apple-itunes-app': 'app-id=1376029326', 'og:image': 'https://images.codecademy.com/social/logo-codecademy-social.png', 'fb:profile_id': 'codecademy', 'og:type': 'website', 'twitter:card': 'summary', 'twitter:title': 'Python Courses & Tutorials | Codecademy', 'og:site_name': 'Codecademy', 'og:title': 'Python Courses & Tutorials | Codecademy', 'og:description': ""Python is a general-purpose, versatile, and powerful programming language. It’s a great first language because it's concise and easy to read. Whatever you want to do, Python can do it. From web development to machine learning to data science, Python is the language for you."", 'twitter:image': 'https://images.codecademy.com/social/logo-codecademy-social.png', 'next-head-count': '38', 'fb:app_id': '307818116683104', 'twitter:site': '@codecademy', 'viewport': 'width=device-width', 'twitter:description': ""Python is a general-purpose, versatile, and powerful programming language. It’s a great first language because it's concise and easy to read. Whatever you want to do, Python can do it. From web development to machine learning to data science, Python is the language for you."", 'og:rich_attachment': 'true'}], 'cse_image': [{'src': 'https://images.codecademy.com/social/logo-codecademy-social.png'}]}",off,1.109379,1,"[{'src': 'https://encrypted-tbn2.gstatic.com/images?q=tbn:ANd9GcSeSIzcQrS7QZR5tfWx0hp68RbiAbhL4M6L3ex3chvuPb_xApS7BXx19h5w', 'width': '310', 'height': '163'}]","[{'apple-itunes-app': 'app-id=1376029326', 'og:image': 'https://images.codecademy.com/social/logo-codecademy-social.png', 'fb:profile_id': 'codecademy', 'og:type': 'website', 'twitter:card': 'summary', 'twitter:title': 'Python Courses & Tutorials | Codecademy', 'og:site_name': 'Codecademy', 'og:title': 'Python Courses & Tutorials | Codecademy', 'og:description': ""Python is a general-purpose, versatile, and powerful programming language. It’s a great first language because it's concise and easy to read. Whatever you want to do, Python can do it. From web development to machine learning to data science, Python is the language for you."", 'twitter:image': 'https://images.codecademy.com/social/logo-codecademy-social.png', 'next-head-count': '38', 'fb:app_id': '307818116683104', 'twitter:site': '@codecademy', 'viewport': 'width=device-width', 'twitter:description': ""Python is a general-purpose, versatile, and powerful programming language. It’s a great first language because it's concise and easy to read. Whatever you want to do, Python can do it. From web development to machine learning to data science, Python is the language for you."", 'og:rich_attachment': 'true'}]",[{'src': 'https://images.codecademy.com/social/logo-codecademy-social.png'}],,,,,,,,,,,,,,,width=device-width,,https://images.codecademy.com/social/logo-codecademy-social.png,website,summary,Python Courses & Tutorials | Codecademy,,Python Courses & Tutorials | Codecademy,,,,,"Python is a general-purpose, versatile, and powerful programming language. It’s a great first language because it's concise and easy to read. Whatever you want to do, Python can do it. From web development to machine learning to data science, Python is the language for you.",,https://images.codecademy.com/social/logo-codecademy-social.png,,@codecademy,"Python is a general-purpose, versatile, and powerful programming language. It’s a great first language because it's concise and easy to read. Whatever you want to do, Python can do it. From web development to machine learning to data science, Python is the language for you.",,,,,,,,,,,,,,,,Codecademy,,,,,,,,,,,,,,,,,,,307818116683104,,,,,,,,,,,,,,,,,app-id=1376029326,,,,,,,,,,,,,,,,,,,,,,,,,,,,,,,,,codecademy,38,true,,,,,,,,,,,,,,,,,,,,,,,,,,,,,,,
26,python,7,Google's Python Class | Python Education | Google Developers,"Jul 25, 2015 ... Welcome to Google's Python Class -- this is a free class for people with a little bit of programming experience who want to learn Python.",developers.google.com,https://developers.google.com/edu/python,2022-09-01 16:26:08.646337+00:00,1340000000,ywRkyQXGTWMJ,10,desss,a283296b1cb8147fd,,1.11,"1,340,000,000",https://developers.google.com/edu/python,https://developers.google.com/edu/<b>python</b>,"Jul 25, 2015 <b>...</b> Welcome to Google&#39;s <b>Python</b> Class -- this is a free class for people with a little bit of programming experience who want to learn <b>Python</b>.",Google&#39;s <b>Python</b> Class | <b>Python</b> Education | Google Developers,utf8,customsearch#result,,utf8,"{'cse_thumbnail': [{'src': 'https://encrypted-tbn3.gstatic.com/images?q=tbn:ANd9GcSnB0EFBVWZBLxqnAEg6KeMq620Ytk90pN1xbNBYYH4qJIwj3kWOKllRdo', 'width': '310', 'height': '163'}], 'document': [{}], 'metatags': [{'og:image': 'https://www.gstatic.com/devrel-devsite/prod/v6bd99c7d8fa6220aea6020b29137b212e2eacdba13242535487f52ab3557b0cb/developers/images/opengraph/cyan.png', 'og:type': 'website', 'theme-color': '#12b5cb', 'og:image:width': '1200', 'twitter:card': 'summary_large_image', 'google-signin-client-id': '721724668570-nbkv1cfusk7kk4eni4pjvepaus73b13t.apps.googleusercontent.com', 'og:site_name': 'Google Developers', 'og:title': ""Google's Python Class \xa0|\xa0 Python Education \xa0|\xa0 Google Developers"", 'og:image:height': '675', 'og:description': 'Assorted educational materials provided by Google.', 'viewport': 'width=device-width, initial-scale=1', 'og:locale': 'en', 'google-signin-scope': 'profile email https://www.googleapis.com/auth/developerprofiles https://www.googleapis.com/auth/developerprofiles.award', 'og:url': 'https://developers.google.com/edu/python'}], 'cse_image': [{'src': 'https://www.gstatic.com/devrel-devsite/prod/v6bd99c7d8fa6220aea6020b29137b212e2eacdba13242535487f52ab3557b0cb/developers/images/opengraph/cyan.png'}]}",off,1.109379,1,"[{'src': 'https://encrypted-tbn3.gstatic.com/images?q=tbn:ANd9GcSnB0EFBVWZBLxqnAEg6KeMq620Ytk90pN1xbNBYYH4qJIwj3kWOKllRdo', 'width': '310', 'height': '163'}]","[{'og:image': 'https://www.gstatic.com/devrel-devsite/prod/v6bd99c7d8fa6220aea6020b29137b212e2eacdba13242535487f52ab3557b0cb/developers/images/opengraph/cyan.png', 'og:type': 'website', 'theme-color': '#12b5cb', 'og:image:width': '1200', 'twitter:card': 'summary_large_image', 'google-signin-client-id': '721724668570-nbkv1cfusk7kk4eni4pjvepaus73b13t.apps.googleusercontent.com', 'og:site_name': 'Google Developers', 'og:title': ""Google's Python Class \xa0|\xa0 Python Education \xa0|\xa0 Google Developers"", 'og:image:height': '675', 'og:description': 'Assorted educational materials provided by Google.', 'viewport': 'width=device-width, initial-scale=1', 'og:locale': 'en', 'google-signin-scope': 'profile email https://www.googleapis.com/auth/developerprofiles https://www.googleapis.com/auth/developerprofiles.award', 'og:url': 'https://developers.google.com/edu/python'}]",[{'src': 'https://www.gstatic.com/devrel-devsite/prod/v6bd99c7d8fa6220aea6020b29137b212e2eacdba13242535487f52ab3557b0cb/developers/images/opengraph/cyan.png'}],,,,,,,,,,[{}],,,,,"width=device-width, initial-scale=1",,https://www.gstatic.com/devrel-devsite/prod/v6bd99c7d8fa6220aea6020b29137b212e2eacdba13242535487f52ab3557b0cb/developers/images/opengraph/cyan.png,website,summary_large_image,,,Google's Python Class  |  Python Education  |  Google Developers,,,,,Assorted educational materials provided by Google.,,,,,,https://developers.google.com/edu/python,,,#12b5cb,,,,,,,,,,,1200,Google Developers,675,,,,,,,,,,,,,,,,,,,,,,,,,,en,,,,,,,,,,,,,,,,,,,,,,,,,,,,,,,,,,,,,,,,,,,,,721724668570-nbkv1cfusk7kk4eni4pjvepaus73b13t.apps.googleusercontent.com,profile email https://www.googleapis.com/auth/developerprofiles https://www.googleapis.com/auth/developerprofiles.award,,,,,,,,,,,,,,,,,,,,,,,,,,,,,
27,python,8,Python - Visual Studio Marketplace,"Jan 19, 2016 ... This includes partial IntelliSense for open files in the editor. Installed extensions. The Python extension will automatically install the ...",marketplace.visualstudio.com,https://marketplace.visualstudio.com/items?itemName=ms-python.python,2022-09-01 16:26:08.646337+00:00,1340000000,Qm8Ivh7KyhAJ,10,desss,a283296b1cb8147fd,,1.11,"1,340,000,000",https://marketplace.visualstudio.com/items?itemName=ms-python.python,https://marketplace.visualstudio.com/items?itemName=ms-<b>python</b>.<b>python</b>,"Jan 19, 2016 <b>...</b> This includes partial IntelliSense for open files in the editor. Installed extensions. The <b>Python</b> extension will automatically install the&nbsp;...",<b>Python</b> - Visual Studio Marketplace,utf8,customsearch#result,,utf8,"{'cse_thumbnail': [{'src': 'https://encrypted-tbn3.gstatic.com/images?q=tbn:ANd9GcRvGJyA3wWdUNp37eYEg-YBYk8EI7UHJTTYkGDIuzcGO_sMeVgjvqMw6Jwo', 'width': '286', 'height': '176'}], 'metatags': [{'og:image': 'https://ms-python.gallerycdn.vsassets.io/extensions/ms-python/python/2022.15.12441015/1662027522375/Microsoft.VisualStudio.Services.Icons.Default', 'og:type': 'website', 'twitter:card': 'summary', 'twitter:site': '@Code', 'og:title': 'Python - Visual Studio Marketplace', 'og:url': 'https://marketplace.visualstudio.com/items?itemName=ms-python.python', 'og:description': 'Extension for Visual Studio Code - IntelliSense (Pylance), Linting, Debugging (multi-threaded, remote), Jupyter Notebooks, code formatting, refactoring, unit tests, and more.'}], 'cse_image': [{'src': 'https://raw.githubusercontent.com/microsoft/vscode-python/main/images/ConfigureDebugger.gif'}]}",off,1.109379,1,"[{'src': 'https://encrypted-tbn3.gstatic.com/images?q=tbn:ANd9GcRvGJyA3wWdUNp37eYEg-YBYk8EI7UHJTTYkGDIuzcGO_sMeVgjvqMw6Jwo', 'width': '286', 'height': '176'}]","[{'og:image': 'https://ms-python.gallerycdn.vsassets.io/extensions/ms-python/python/2022.15.12441015/1662027522375/Microsoft.VisualStudio.Services.Icons.Default', 'og:type': 'website', 'twitter:card': 'summary', 'twitter:site': '@Code', 'og:title': 'Python - Visual Studio Marketplace', 'og:url': 'https://marketplace.visualstudio.com/items?itemName=ms-python.python', 'og:description': 'Extension for Visual Studio Code - IntelliSense (Pylance), Linting, Debugging (multi-threaded, remote), Jupyter Notebooks, code formatting, refactoring, unit tests, and more.'}]",[{'src': 'https://raw.githubusercontent.com/microsoft/vscode-python/main/images/ConfigureDebugger.gif'}],,,,,,,,,,,,,,,,,https://ms-python.gallerycdn.vsassets.io/extensions/ms-python/python/2022.15.12441015/1662027522375/Microsoft.VisualStudio.Services.Icons.Default,website,summary,,,Python - Visual Studio Marketplace,,,,,"Extension for Visual Studio Code - IntelliSense (Pylance), Linting, Debugging (multi-threaded, remote), Jupyter Notebooks, code formatting, refactoring, unit tests, and more.",,,,@Code,,https://marketplace.visualstudio.com/items?itemName=ms-python.python,,,,,,,,,,,,,,,,,,,,,,,,,,,,,,,,,,,,,,,,,,,,,,,,,,,,,,,,,,,,,,,,,,,,,,,,,,,,,,,,,,,,,,,,,,,,,,,,,,,,,,,,,,,,,,,,,,,,,
28,python,9,PyPI · The Python Package Index,The Python Package Index (PyPI) is a repository of software for the Python programming language.,pypi.org,https://pypi.org/,2022-09-01 16:26:08.646337+00:00,1340000000,5_j0NGF3qFUJ,10,desss,a283296b1cb8147fd,,1.11,"1,340,000,000",https://pypi.org/,https://pypi.org/,The <b>Python</b> Package Index (PyPI) is a repository of software for the <b>Python</b> programming language.,PyPI · The <b>Python</b> Package Index,utf8,customsearch#result,,utf8,"{'cse_thumbnail': [{'src': 'https://encrypted-tbn3.gstatic.com/images?q=tbn:ANd9GcRDV-cOAFyIlLZJVTrUfs6iVmXe9O8aPAH9Ii793OFwuNRLkD69kGQ1FINF', 'width': '225', 'height': '225'}], 'metatags': [{'availablelanguages': 'en, es, fr, ja, pt_BR, uk, el, de, zh_Hans, zh_Hant, ru, he, eo', 'og:image': 'https://pypi.org/static/images/twitter.6fecba6f.jpg', 'og:type': 'website', 'og:site_name': 'PyPI', 'viewport': 'width=device-width, initial-scale=1', 'defaultlanguage': 'en', 'og:url': 'https://pypi.org/', 'og:description': 'The Python Package Index (PyPI) is a repository of software for the Python programming language.'}], 'cse_image': [{'src': 'https://pypi.org/static/images/twitter.6fecba6f.jpg'}]}",off,1.109379,1,"[{'src': 'https://encrypted-tbn3.gstatic.com/images?q=tbn:ANd9GcRDV-cOAFyIlLZJVTrUfs6iVmXe9O8aPAH9Ii793OFwuNRLkD69kGQ1FINF', 'width': '225', 'height': '225'}]","[{'availablelanguages': 'en, es, fr, ja, pt_BR, uk, el, de, zh_Hans, zh_Hant, ru, he, eo', 'og:image': 'https://pypi.org/static/images/twitter.6fecba6f.jpg', 'og:type': 'website', 'og:site_name': 'PyPI', 'viewport': 'width=device-width, initial-scale=1', 'defaultlanguage': 'en', 'og:url': 'https://pypi.org/', 'og:description': 'The Python Package Index (PyPI) is a repository of software for the Python programming language.'}]",[{'src': 'https://pypi.org/static/images/twitter.6fecba6f.jpg'}],,,,,,,,,,,,,,,"width=device-width, initial-scale=1",,https://pypi.org/static/images/twitter.6fecba6f.jpg,website,,,,,,,,,The Python Package Index (PyPI) is a repository of software for the Python programming language.,,,,,,https://pypi.org/,,,,,,,,,,,,,,,PyPI,,,,,,,,,,,,,,,,,,,,,,,,,,,,,,,,,,,,,,,,,,,,,,,,,,,,,,,,,,,,,,,,,,,,,,,,,,"en, es, fr, ja, pt_BR, uk, el, de, zh_Hans, zh_Hant, ru, he, eo",en,,,,,,,,,,,,,,,,,,,,,,,,,,,
29,python,10,python - Official Image | Docker Hub,"Python is an interpreted, interactive, object-oriented, open-source programming language.",hub.docker.com,https://hub.docker.com/_/python,2022-09-01 16:26:08.646337+00:00,1340000000,Fzb3FZVdGiQJ,10,desss,a283296b1cb8147fd,,1.11,"1,340,000,000",https://hub.docker.com/_/python,https://hub.docker.com/_/<b>python</b>,"<b>Python</b> is an interpreted, interactive, object-oriented, open-source programming language.",<b>python</b> - Official Image | Docker Hub,utf8,customsearch#result,,utf8,"{'metatags': [{'viewport': 'width=device-width, initial-scale=1.0, maximum-scale=1.0, user-scalable=0'}]}",off,1.109379,1,,"[{'viewport': 'width=device-width, initial-scale=1.0, maximum-scale=1.0, user-scalable=0'}]",,,,,,,,,,,,,,,,"width=device-width, initial-scale=1.0, maximum-scale=1.0, user-scalable=0",,,,,,,,,,,,,,,,,,,,,,,,,,,,,,,,,,,,,,,,,,,,,,,,,,,,,,,,,,,,,,,,,,,,,,,,,,,,,,,,,,,,,,,,,,,,,,,,,,,,,,,,,,,,,,,,,,,,,,,,,,,,,,,,,,,,,,,
