,searchTerms,rank,title,snippet,displayLink,link,queryTime,totalResults,cacheId,count,cseName,cx,fileFormat,formattedSearchTime,formattedTotalResults,formattedUrl,htmlFormattedUrl,htmlSnippet,htmlTitle,inputEncoding,kind,mime,outputEncoding,pagemap,safe,searchTime,startIndex,cse_thumbnail,metatags,cse_image,xfn,imageobject,person,interactioncounter,collection,creativework,socialmediaposting,sitenavigationelement,softwaresourcecode,document,listitem,Person,webpage,charset,viewport,keyword,og:image,og:type,twitter:card,twitter:title,al:ios:app_name,og:title,al:android:package,pagekey,locale,al:ios:url,og:description,al:ios:app_store_id,twitter:image,al:android:url,twitter:site,twitter:description,og:url,al:android:app_name,msapplication-tilecolor,theme-color,egms.systemid,platform-worker,platform,profile:last_name,litmsprofilename,profile:first_name,ubba,apple-mobile-web-app-status-bar-style,mobile-web-app-capable,og:image:alt,og:image:width,og:site_name,og:image:height,og:image:secure_url,creationdate,creator,author,msip_label_2f46dfe0_534f_4c95_815c_5b1af86b9823_siteid,metatag_title,contenttypeid,msip_label_2f46dfe0_534f_4c95_815c_5b1af86b9823_setdate,moddate,msip_label_2f46dfe0_534f_4c95_815c_5b1af86b9823_method,msip_label_2f46dfe0_534f_4c95_815c_5b1af86b9823_actionid,msip_label_2f46dfe0_534f_4c95_815c_5b1af86b9823_contentbits,msip_label_2f46dfe0_534f_4c95_815c_5b1af86b9823_enabled,msip_label_2f46dfe0_534f_4c95_815c_5b1af86b9823_name,producer,apple-mobile-web-app-title,facebook-domain-verification,fb:app_id,handheldfriendly,mobileoptimized,docsearch:language,twitter:label1,msapplication-tileimage,twitter:data1,article:modified_time,og:locale,fb:pages,article:author,article:publisher,topicid,s_1stimp,referrer,format-detection,octolytics-url,apple-itunes-app,hovercard-subject-tag,turbo-body-classes,html-safe-nonce,expected-hostname,browser-errors-url,octolytics-dimension-user_login,hostname,browser-stats-url,visitor-payload,github-keyboard-shortcuts,octolytics-dimension-repository_id,octolytics-dimension-repository_network_root_nwo,enabled-features,optimizely-datafile,visitor-hmac,turbo-cache-control,request-id,analytics-location,color-scheme,octolytics-dimension-repository_is_fork,go-import,browser-optimizely-client-errors-url,twitter:image:src,octolytics-dimension-user_id,octolytics-dimension-repository_public,octolytics-dimension-repository_network_root_id,octolytics-dimension-repository_nwo,og:image:type,application-name,msapplication-tooltip,msapplication-navbutton-color,apple-mobile-web-app-capable,fb:profile_id,next-head-count,og:rich_attachment,google-signin-client-id,google-signin-scope,availablelanguages,defaultlanguage,follow.it-verification-code-alrgnmtwb0zjumpkwgdnenhpuvz4wwtlavdtnfjzq1jzwtforktxvlhxs0g0dg1gtct3ddhkr3beeknwv0lnzhbesgxmrejqnedkue9lmktbulleqlppqw8zdwrscunku0t0b1hosllvoxlyt2p4wgzmctvptk5ksnk3n2fhutb8duc5b2llv212dfgzu3zfcfbjym1xl0c0a1h1zhk5ehrxvmluqjnkrk5sst0=,vicurrentdatetime,msvalidate.01,fb:page_id,twitter:account_id,og:keywords,article:published_time,ibmdotcom.version.styles,dcterms.date,geo.country,og:published_time,dcterms.rights,ibmdotcom.version.react,ibmdotcom.build.time,csrf-token,csrf-param,page-name,ahrefs-site-verification,brightspot.cached,brightspot.syncenvironment,site-id,lens,siteprimaryurl,brightspot.environment,brightspot.contentid,article:section,og:updated_time
0,desss,1,DESSS: ERP Implementation | Mobile app development | Website ...,"DESSS provides ERP consulting, mobile app development, web Application development, responsive Web design, eCommerce solutions, and CRM consulting services ...",www.desss.com,https://www.desss.com/,2022-09-01 16:26:08.598366+00:00,93400000,rJsAzNzAXAQJ,10,desss,a283296b1cb8147fd,,0.47,"93,400,000",https://www.desss.com/,https://www.<b>desss</b>.com/,"<b>DESSS</b> provides ERP consulting, mobile app development, web Application development, responsive Web design, eCommerce solutions, and CRM consulting services&nbsp;...",<b>DESSS</b>: ERP Implementation | Mobile app development | Website ...,utf8,customsearch#result,,utf8,"{'cse_thumbnail': [{'src': 'https://encrypted-tbn3.gstatic.com/images?q=tbn:ANd9GcTayqdL1AIUcH2M8d_bYXv_YH_UTYP-yYpB_kpHu_Wwu7i2ZFA46wm1Zj0', 'width': '182', 'height': '276'}], 'metatags': [{'charset': 'utf-8', 'viewport': 'width=device-width, height=device-height, initial-scale=1, minimum-scale=1, maximum-scale=5', 'keyword': 'mobile app development, web design, website design, app development, web design company, web page design, website design company, android app development, responsive web design, web design agency, best website design, web development company, web design services, app development companies, mobile app development company, mobile application development, website designer near me, ecommerce website design, mobile development'}], 'cse_image': [{'src': 'https://www.desss.com/assets/images/desss/text-image-full-width/330-500/our%20goleee.webp'}]}",off,0.474203,1,"[{'src': 'https://encrypted-tbn3.gstatic.com/images?q=tbn:ANd9GcTayqdL1AIUcH2M8d_bYXv_YH_UTYP-yYpB_kpHu_Wwu7i2ZFA46wm1Zj0', 'width': '182', 'height': '276'}]","[{'charset': 'utf-8', 'viewport': 'width=device-width, height=device-height, initial-scale=1, minimum-scale=1, maximum-scale=5', 'keyword': 'mobile app development, web design, website design, app development, web design company, web page design, website design company, android app development, responsive web design, web design agency, best website design, web development company, web design services, app development companies, mobile app development company, mobile application development, website designer near me, ecommerce website design, mobile development'}]",[{'src': 'https://www.desss.com/assets/images/desss/text-image-full-width/330-500/our%20goleee.webp'}],,,,,,,,,,,,,,utf-8,"width=device-width, height=device-height, initial-scale=1, minimum-scale=1, maximum-scale=5","mobile app development, web design, website design, app development, web design company, web page design, website design company, android app development, responsive web design, web design agency, best website design, web development company, web design services, app development companies, mobile app development company, mobile application development, website designer near me, ecommerce website design, mobile development",,,,,,,,,,,,,,,,,,,,,,,,,,,,,,,,,,,,,,,,,,,,,,,,,,,,,,,,,,,,,,,,,,,,,,,,,,,,,,,,,,,,,,,,,,,,,,,,,,,,,,,,,,,,,,,,,,,,,,,,,,,,,,,,,,,,,,
1,desss,2,DESSS Inc | LinkedIn,"DESSS Inc | 261 followers on LinkedIn. Award Winner - Best Web Design and Development Company for 10 consecutive years | DESSS Inc, one of the leading Web ...",www.linkedin.com,https://www.linkedin.com/company/desss-inc,2022-09-01 16:26:08.598366+00:00,93400000,,10,desss,a283296b1cb8147fd,,0.47,"93,400,000",https://www.linkedin.com/company/desss-inc,https://www.linkedin.com/company/<b>desss</b>-inc,"<b>DESSS</b> Inc | 261 followers on LinkedIn. Award Winner - Best Web Design and Development Company for 10 consecutive years | <b>DESSS</b> Inc, one of the leading Web&nbsp;...",<b>DESSS</b> Inc | LinkedIn,utf8,customsearch#result,,utf8,"{'cse_thumbnail': [{'src': 'https://encrypted-tbn3.gstatic.com/images?q=tbn:ANd9GcQ5Hfe9PiqiNiBFj5olz2ObxPDw6SD40Ga7kpPNYItHGhTM3m3k3gSBX9Y', 'width': '200', 'height': '200'}], 'metatags': [{'og:image': 'https://media-exp1.licdn.com/dms/image/C560BAQF26-wF1_IbAQ/company-logo_200_200/0/1641625994350?e=2147483647&v=beta&t=2Fo3PssTIbYduOgvtsBNFkjQQtqbdnwI28FKD3lEbv8', 'og:type': 'article', 'twitter:card': 'summary', 'twitter:title': 'DESSS Inc | LinkedIn', 'al:ios:app_name': 'LinkedIn', 'og:title': 'DESSS Inc | LinkedIn', 'al:android:package': 'com.linkedin.android', 'pagekey': 'p_org_guest_company_overview', 'locale': 'en_US', 'al:ios:url': 'https://www.linkedin.com/company/desss-inc', 'og:description': 'DESSS Inc | 261 followers on LinkedIn. Award Winner - Best Web Design and Development Company for 10 consecutive years  | DESSS Inc, one of the leading Web Design and Mobile App Development companies in Houston Texas, comprises a team of knowledgeable people who serve any IT requirements with due diligence and dedication. We deliver the following services - Application services, Cloud services, DBA, Managed IT services, Mobile App Development, Web Development, Share point services, Digital Marketing Services, Staffing solutions, transcription services, etc. We have been awarded as the best Web Design and Development Company for 10 consecutive years by Houston Business Journals.', 'al:ios:app_store_id': '288429040', 'twitter:image': 'https://media-exp1.licdn.com/dms/image/C560BAQF26-wF1_IbAQ/company-logo_200_200/0/1641625994350?e=2147483647&v=beta&t=2Fo3PssTIbYduOgvtsBNFkjQQtqbdnwI28FKD3lEbv8', 'al:android:url': 'https://www.linkedin.com/company/desss-inc', 'twitter:site': '@linkedin', 'viewport': 'width=device-width, initial-scale=1.0', 'twitter:description': 'DESSS Inc | 261 followers on LinkedIn. Award Winner - Best Web Design and Development Company for 10 consecutive years  | DESSS Inc, one of the leading Web Design and Mobile App Development companies in Houston Texas, comprises a team of knowledgeable people who serve any IT requirements with due diligence and dedication. We deliver the following services - Application services, Cloud services, DBA, Managed IT services, Mobile App Development, Web Development, Share point services, Digital Marketing Services, Staffing solutions, transcription services, etc. We have been awarded as the best Web Design and Development Company for 10 consecutive years by Houston Business Journals.', 'og:url': 'https://www.linkedin.com/company/desss-inc', 'al:android:app_name': 'LinkedIn'}], 'cse_image': [{'src': 'https://media-exp1.licdn.com/dms/image/C560BAQF26-wF1_IbAQ/company-logo_200_200/0/1641625994350?e=2147483647&v=beta&t=2Fo3PssTIbYduOgvtsBNFkjQQtqbdnwI28FKD3lEbv8'}]}",off,0.474203,1,"[{'src': 'https://encrypted-tbn3.gstatic.com/images?q=tbn:ANd9GcQ5Hfe9PiqiNiBFj5olz2ObxPDw6SD40Ga7kpPNYItHGhTM3m3k3gSBX9Y', 'width': '200', 'height': '200'}]","[{'og:image': 'https://media-exp1.licdn.com/dms/image/C560BAQF26-wF1_IbAQ/company-logo_200_200/0/1641625994350?e=2147483647&v=beta&t=2Fo3PssTIbYduOgvtsBNFkjQQtqbdnwI28FKD3lEbv8', 'og:type': 'article', 'twitter:card': 'summary', 'twitter:title': 'DESSS Inc | LinkedIn', 'al:ios:app_name': 'LinkedIn', 'og:title': 'DESSS Inc | LinkedIn', 'al:android:package': 'com.linkedin.android', 'pagekey': 'p_org_guest_company_overview', 'locale': 'en_US', 'al:ios:url': 'https://www.linkedin.com/company/desss-inc', 'og:description': 'DESSS Inc | 261 followers on LinkedIn. Award Winner - Best Web Design and Development Company for 10 consecutive years  | DESSS Inc, one of the leading Web Design and Mobile App Development companies in Houston Texas, comprises a team of knowledgeable people who serve any IT requirements with due diligence and dedication. We deliver the following services - Application services, Cloud services, DBA, Managed IT services, Mobile App Development, Web Development, Share point services, Digital Marketing Services, Staffing solutions, transcription services, etc. We have been awarded as the best Web Design and Development Company for 10 consecutive years by Houston Business Journals.', 'al:ios:app_store_id': '288429040', 'twitter:image': 'https://media-exp1.licdn.com/dms/image/C560BAQF26-wF1_IbAQ/company-logo_200_200/0/1641625994350?e=2147483647&v=beta&t=2Fo3PssTIbYduOgvtsBNFkjQQtqbdnwI28FKD3lEbv8', 'al:android:url': 'https://www.linkedin.com/company/desss-inc', 'twitter:site': '@linkedin', 'viewport': 'width=device-width, initial-scale=1.0', 'twitter:description': 'DESSS Inc | 261 followers on LinkedIn. Award Winner - Best Web Design and Development Company for 10 consecutive years  | DESSS Inc, one of the leading Web Design and Mobile App Development companies in Houston Texas, comprises a team of knowledgeable people who serve any IT requirements with due diligence and dedication. We deliver the following services - Application services, Cloud services, DBA, Managed IT services, Mobile App Development, Web Development, Share point services, Digital Marketing Services, Staffing solutions, transcription services, etc. We have been awarded as the best Web Design and Development Company for 10 consecutive years by Houston Business Journals.', 'og:url': 'https://www.linkedin.com/company/desss-inc', 'al:android:app_name': 'LinkedIn'}]",[{'src': 'https://media-exp1.licdn.com/dms/image/C560BAQF26-wF1_IbAQ/company-logo_200_200/0/1641625994350?e=2147483647&v=beta&t=2Fo3PssTIbYduOgvtsBNFkjQQtqbdnwI28FKD3lEbv8'}],,,,,,,,,,,,,,,"width=device-width, initial-scale=1.0",,https://media-exp1.licdn.com/dms/image/C560BAQF26-wF1_IbAQ/company-logo_200_200/0/1641625994350?e=2147483647&v=beta&t=2Fo3PssTIbYduOgvtsBNFkjQQtqbdnwI28FKD3lEbv8,article,summary,DESSS Inc | LinkedIn,LinkedIn,DESSS Inc | LinkedIn,com.linkedin.android,p_org_guest_company_overview,en_US,https://www.linkedin.com/company/desss-inc,"DESSS Inc | 261 followers on LinkedIn. Award Winner - Best Web Design and Development Company for 10 consecutive years  | DESSS Inc, one of the leading Web Design and Mobile App Development companies in Houston Texas, comprises a team of knowledgeable people who serve any IT requirements with due diligence and dedication. We deliver the following services - Application services, Cloud services, DBA, Managed IT services, Mobile App Development, Web Development, Share point services, Digital Marketing Services, Staffing solutions, transcription services, etc. We have been awarded as the best Web Design and Development Company for 10 consecutive years by Houston Business Journals.",288429040,https://media-exp1.licdn.com/dms/image/C560BAQF26-wF1_IbAQ/company-logo_200_200/0/1641625994350?e=2147483647&v=beta&t=2Fo3PssTIbYduOgvtsBNFkjQQtqbdnwI28FKD3lEbv8,https://www.linkedin.com/company/desss-inc,@linkedin,"DESSS Inc | 261 followers on LinkedIn. Award Winner - Best Web Design and Development Company for 10 consecutive years  | DESSS Inc, one of the leading Web Design and Mobile App Development companies in Houston Texas, comprises a team of knowledgeable people who serve any IT requirements with due diligence and dedication. We deliver the following services - Application services, Cloud services, DBA, Managed IT services, Mobile App Development, Web Development, Share point services, Digital Marketing Services, Staffing solutions, transcription services, etc. We have been awarded as the best Web Design and Development Company for 10 consecutive years by Houston Business Journals.",https://www.linkedin.com/company/desss-inc,LinkedIn,,,,,,,,,,,,,,,,,,,,,,,,,,,,,,,,,,,,,,,,,,,,,,,,,,,,,,,,,,,,,,,,,,,,,,,,,,,,,,,,,,,,,,,,,,,,,,,,,,,,,,,,,,,,,,,,,,,,
2,desss,3,Discretionary East Sussex Support Scheme (DESSS),The Discretionary East Sussex Support Scheme (DESSS) provides emergency help in certain situations. It does not provide cash or loans but may provide the ...,www.eastsussex.gov.uk,https://www.eastsussex.gov.uk/social-care/benefits/discretionary-east-sussex-support-scheme-desss,2022-09-01 16:26:08.598366+00:00,93400000,Eq9LlpKIhdwJ,10,desss,a283296b1cb8147fd,,0.47,"93,400,000",https://www.eastsussex.gov.uk/.../discretionary-east-sussex-support-scheme- desss,https://www.eastsussex.gov.uk/.../discretionary-east-sussex-support-scheme- <b>desss</b>,The <b>Discretionary East Sussex Support Scheme</b> (<b>DESSS</b>) provides emergency help in certain situations. It does not provide cash or loans but may provide the&nbsp;...,<b>Discretionary East Sussex Support Scheme</b> (<b>DESSS</b>),utf8,customsearch#result,,utf8,"{'metatags': [{'msapplication-tilecolor': '#00a1de', 'theme-color': '#ffffff', 'og:type': 'article', 'twitter:card': 'summary', 'twitter:title': 'Help with food and utilities', 'twitter:site': '@eastsussexcc', 'viewport': 'width=device-width, initial-scale=1, viewport-fit=cover', 'twitter:description': 'How to get help with food', 'og:title': 'Help with food and utilities', 'og:url': 'https://www.eastsussex.gov.uk/social-care/benefits/discretionary-east-sussex-support-scheme-desss/food-utilities', 'egms.systemid': '3508'}]}",off,0.474203,1,,"[{'msapplication-tilecolor': '#00a1de', 'theme-color': '#ffffff', 'og:type': 'article', 'twitter:card': 'summary', 'twitter:title': 'Help with food and utilities', 'twitter:site': '@eastsussexcc', 'viewport': 'width=device-width, initial-scale=1, viewport-fit=cover', 'twitter:description': 'How to get help with food', 'og:title': 'Help with food and utilities', 'og:url': 'https://www.eastsussex.gov.uk/social-care/benefits/discretionary-east-sussex-support-scheme-desss/food-utilities', 'egms.systemid': '3508'}]",,,,,,,,,,,,,,,,"width=device-width, initial-scale=1, viewport-fit=cover",,,article,summary,Help with food and utilities,,Help with food and utilities,,,,,,,,,@eastsussexcc,How to get help with food,https://www.eastsussex.gov.uk/social-care/benefits/discretionary-east-sussex-support-scheme-desss/food-utilities,,#00a1de,#ffffff,3508,,,,,,,,,,,,,,,,,,,,,,,,,,,,,,,,,,,,,,,,,,,,,,,,,,,,,,,,,,,,,,,,,,,,,,,,,,,,,,,,,,,,,,,,,,,,,,,,,,,,,,,,,,,,,,,,,
3,desss,4,Dev Chandrasekar - Owner - DESSS INC | LinkedIn,DESSS is an Information Technology (IT) services and BPO company. DESSS is engaged in the provision of consulting and delivering comprehensive business process ...,www.linkedin.com,https://www.linkedin.com/in/dev-chandrasekar-00011227,2022-09-01 16:26:08.598366+00:00,93400000,,10,desss,a283296b1cb8147fd,,0.47,"93,400,000",https://www.linkedin.com/in/dev-chandrasekar-00011227,https://www.linkedin.com/in/dev-chandrasekar-00011227,<b>DESSS</b> is an Information Technology (IT) services and BPO company. <b>DESSS</b> is engaged in the provision of consulting and delivering comprehensive business process&nbsp;...,Dev Chandrasekar - Owner - <b>DESSS</b> INC | LinkedIn,utf8,customsearch#result,,utf8,"{'cse_thumbnail': [{'src': 'https://encrypted-tbn3.gstatic.com/images?q=tbn:ANd9GcS7Y3RIgs1Z7pg70cjz4PrvqZZqyu72xRSZVeGNyq0CzS0QUQaugbZd', 'width': '80', 'height': '80'}], 'metatags': [{'og:image': 'https://media-exp1.licdn.com/dms/image/C4D03AQEw3HMrohxFAw/profile-displayphoto-shrink_200_200/0/1517437824613?e=2147483647&v=beta&t=5BSxjjtYjCkQDwXo49Z1KgxPq9o5FYmn28FiBNkJ4sM', 'twitter:card': 'summary', 'platform-worker': 'https://static-exp1.licdn.com/sc/h/7nirg34a8ey4y2l4rw7xgwxx4', 'al:android:package': 'com.linkedin.android', 'locale': 'en_US', 'al:ios:url': 'https://www.linkedin.com/in/dev-chandrasekar-00011227', 'og:description': 'View Dev Chandrasekar’s profile on LinkedIn, the world’s largest professional community. Dev has 2 jobs listed on their profile. See the complete profile on LinkedIn and discover Dev’s connections and jobs at similar companies.', 'al:ios:app_store_id': '288429040', 'platform': 'https://static-exp1.licdn.com/sc/h/831kgo43okdba6h2tz1wtfkit', 'twitter:image': 'https://media-exp1.licdn.com/dms/image/C4D03AQEw3HMrohxFAw/profile-displayphoto-shrink_200_200/0/1517437824613?e=2147483647&v=beta&t=5BSxjjtYjCkQDwXo49Z1KgxPq9o5FYmn28FiBNkJ4sM', 'profile:last_name': 'Chandrasekar', 'twitter:site': '@Linkedin', 'litmsprofilename': 'public-profile-frontend', 'profile:first_name': 'Dev', 'og:type': 'profile', 'twitter:title': 'Dev Chandrasekar - Owner - DESSS INC | LinkedIn', 'al:ios:app_name': 'LinkedIn', 'og:title': 'Dev Chandrasekar - Owner - DESSS INC | LinkedIn', 'pagekey': 'public_profile_v3_mobile', 'al:android:url': 'https://www.linkedin.com/in/dev-chandrasekar-00011227', 'viewport': 'width=device-width, initial-scale=1.0', 'twitter:description': 'View Dev Chandrasekar’s profile on LinkedIn, the world’s largest professional community. Dev has 2 jobs listed on their profile. See the complete profile on LinkedIn and discover Dev’s connections and jobs at similar companies.', 'ubba': 'https://static-exp1.licdn.com/sc/h/45r730ke42wss7mqw6ry9sr0q', 'og:url': 'https://www.linkedin.com/in/dev-chandrasekar-00011227', 'al:android:app_name': 'LinkedIn'}], 'cse_image': [{'src': 'https://media-exp1.licdn.com/dms/image/C4D03AQEw3HMrohxFAw/profile-displayphoto-shrink_200_200/0/1517437824613?e=2147483647&v=beta&t=5BSxjjtYjCkQDwXo49Z1KgxPq9o5FYmn28FiBNkJ4sM'}]}",off,0.474203,1,"[{'src': 'https://encrypted-tbn3.gstatic.com/images?q=tbn:ANd9GcS7Y3RIgs1Z7pg70cjz4PrvqZZqyu72xRSZVeGNyq0CzS0QUQaugbZd', 'width': '80', 'height': '80'}]","[{'og:image': 'https://media-exp1.licdn.com/dms/image/C4D03AQEw3HMrohxFAw/profile-displayphoto-shrink_200_200/0/1517437824613?e=2147483647&v=beta&t=5BSxjjtYjCkQDwXo49Z1KgxPq9o5FYmn28FiBNkJ4sM', 'twitter:card': 'summary', 'platform-worker': 'https://static-exp1.licdn.com/sc/h/7nirg34a8ey4y2l4rw7xgwxx4', 'al:android:package': 'com.linkedin.android', 'locale': 'en_US', 'al:ios:url': 'https://www.linkedin.com/in/dev-chandrasekar-00011227', 'og:description': 'View Dev Chandrasekar’s profile on LinkedIn, the world’s largest professional community. Dev has 2 jobs listed on their profile. See the complete profile on LinkedIn and discover Dev’s connections and jobs at similar companies.', 'al:ios:app_store_id': '288429040', 'platform': 'https://static-exp1.licdn.com/sc/h/831kgo43okdba6h2tz1wtfkit', 'twitter:image': 'https://media-exp1.licdn.com/dms/image/C4D03AQEw3HMrohxFAw/profile-displayphoto-shrink_200_200/0/1517437824613?e=2147483647&v=beta&t=5BSxjjtYjCkQDwXo49Z1KgxPq9o5FYmn28FiBNkJ4sM', 'profile:last_name': 'Chandrasekar', 'twitter:site': '@Linkedin', 'litmsprofilename': 'public-profile-frontend', 'profile:first_name': 'Dev', 'og:type': 'profile', 'twitter:title': 'Dev Chandrasekar - Owner - DESSS INC | LinkedIn', 'al:ios:app_name': 'LinkedIn', 'og:title': 'Dev Chandrasekar - Owner - DESSS INC | LinkedIn', 'pagekey': 'public_profile_v3_mobile', 'al:android:url': 'https://www.linkedin.com/in/dev-chandrasekar-00011227', 'viewport': 'width=device-width, initial-scale=1.0', 'twitter:description': 'View Dev Chandrasekar’s profile on LinkedIn, the world’s largest professional community. Dev has 2 jobs listed on their profile. See the complete profile on LinkedIn and discover Dev’s connections and jobs at similar companies.', 'ubba': 'https://static-exp1.licdn.com/sc/h/45r730ke42wss7mqw6ry9sr0q', 'og:url': 'https://www.linkedin.com/in/dev-chandrasekar-00011227', 'al:android:app_name': 'LinkedIn'}]",[{'src': 'https://media-exp1.licdn.com/dms/image/C4D03AQEw3HMrohxFAw/profile-displayphoto-shrink_200_200/0/1517437824613?e=2147483647&v=beta&t=5BSxjjtYjCkQDwXo49Z1KgxPq9o5FYmn28FiBNkJ4sM'}],,,,,,,,,,,,,,,"width=device-width, initial-scale=1.0",,https://media-exp1.licdn.com/dms/image/C4D03AQEw3HMrohxFAw/profile-displayphoto-shrink_200_200/0/1517437824613?e=2147483647&v=beta&t=5BSxjjtYjCkQDwXo49Z1KgxPq9o5FYmn28FiBNkJ4sM,profile,summary,Dev Chandrasekar - Owner - DESSS INC | LinkedIn,LinkedIn,Dev Chandrasekar - Owner - DESSS INC | LinkedIn,com.linkedin.android,public_profile_v3_mobile,en_US,https://www.linkedin.com/in/dev-chandrasekar-00011227,"View Dev Chandrasekar’s profile on LinkedIn, the world’s largest professional community. Dev has 2 jobs listed on their profile. See the complete profile on LinkedIn and discover Dev’s connections and jobs at similar companies.",288429040,https://media-exp1.licdn.com/dms/image/C4D03AQEw3HMrohxFAw/profile-displayphoto-shrink_200_200/0/1517437824613?e=2147483647&v=beta&t=5BSxjjtYjCkQDwXo49Z1KgxPq9o5FYmn28FiBNkJ4sM,https://www.linkedin.com/in/dev-chandrasekar-00011227,@Linkedin,"View Dev Chandrasekar’s profile on LinkedIn, the world’s largest professional community. Dev has 2 jobs listed on their profile. See the complete profile on LinkedIn and discover Dev’s connections and jobs at similar companies.",https://www.linkedin.com/in/dev-chandrasekar-00011227,LinkedIn,,,,https://static-exp1.licdn.com/sc/h/7nirg34a8ey4y2l4rw7xgwxx4,https://static-exp1.licdn.com/sc/h/831kgo43okdba6h2tz1wtfkit,Chandrasekar,public-profile-frontend,Dev,https://static-exp1.licdn.com/sc/h/45r730ke42wss7mqw6ry9sr0q,,,,,,,,,,,,,,,,,,,,,,,,,,,,,,,,,,,,,,,,,,,,,,,,,,,,,,,,,,,,,,,,,,,,,,,,,,,,,,,,,,,,,,,,,,,,,,,,,,,,,,,,,,,
