thick yoga mats,1,The 6 Best Thick Yoga Mats,"Sep 29, 2018 ... That being said, the best thick yoga mats aren't just about thickness. They 
combine all the features of a great yoga mat, including balance and ...",www.elitedaily.com,https://www.elitedaily.com/p/the-6-best-thick-yoga-mats-12010354,2020-02-22 20:08:28.103705+00:00,13100000,EPZ0RQ0ns5AJ,10,PySearch,012859022920491477448:pubdbfjmmec,0.36,"13,100,000",https://www.elitedaily.com/p/the-6-best-thick-yoga-mats-12010354,https://www.elitedaily.com/p/the-6-best-<b>thick</b>-<b>yoga</b>-<b>mats</b>-12010354,"Sep 29, 2018 <b>...</b> That being said, the best <b>thick yoga mats</b> aren&#39;t just about thickness. They <br>
combine all the features of a great yoga mat, including balance and&nbsp;...",The 6 Best <b>Thick Yoga Mats</b>,utf8,customsearch#result,utf8,"{'cse_thumbnail': [{'src': 'https://encrypted-tbn3.gstatic.com/images?q=tbn:ANd9GcRYfdYwBgzO6_1lreSgo1-rRCEhdgjNxFOkFWBRHBh_YFqC5aushm_9su0', 'width': '310', 'height': '163'}], 'metatags': [{'og:image': 'https://imgix.bustle.com/uploads/image/2018/9/24/d497a07f-6d7e-4bc7-8d84-253310f3ac99-best-extra-thick-yoga-mats.jpg?w=1200&h=630&q=70&fit=crop&crop=faces&fm=jpg', 'og:type': 'article', 'og:image:width': '1200', 'twitter:card': 'summary_large_image', 'og:site_name': 'Elite Daily', 'og:title': 'The 6 Best Thick Yoga Mats', 'og:image:height': '630', 'fb:pages': '237865036265136', 'og:description': ""If you've ever felt the pain of a hardwood floor against your knees in Table Top Pose, you've probably realized the importance of a well-cushioned foundation. That being said, the best thick yoga mats aren't just about thickness. They combine all…"", 'referrer': 'unsafe-url', 'fb:app_id': '378366428966386', 'twitter:site': '@elitedaily', 'viewport': 'width=device-width,initial-scale=1', 'og:url': 'https://www.elitedaily.com/p/the-6-best-thick-yoga-mats-12010354'}], 'cse_image': [{'src': 'https://imgix.bustle.com/uploads/image/2018/9/24/d497a07f-6d7e-4bc7-8d84-253310f3ac99-best-extra-thick-yoga-mats.jpg?w=1200&h=630&q=70&fit=crop&crop=faces&fm=jpg'}]}",off,0.357634,1,[{'src': 'https://imgix.bustle.com/uploads/image/2018/9/24/d497a07f-6d7e-4bc7-8d84-253310f3ac99-best-extra-thick-yoga-mats.jpg?w=1200&h=630&q=70&fit=crop&crop=faces&fm=jpg'}],"[{'src': 'https://encrypted-tbn3.gstatic.com/images?q=tbn:ANd9GcRYfdYwBgzO6_1lreSgo1-rRCEhdgjNxFOkFWBRHBh_YFqC5aushm_9su0', 'width': '310', 'height': '163'}]","[{'og:image': 'https://imgix.bustle.com/uploads/image/2018/9/24/d497a07f-6d7e-4bc7-8d84-253310f3ac99-best-extra-thick-yoga-mats.jpg?w=1200&h=630&q=70&fit=crop&crop=faces&fm=jpg', 'og:type': 'article', 'og:image:width': '1200', 'twitter:card': 'summary_large_image', 'og:site_name': 'Elite Daily', 'og:title': 'The 6 Best Thick Yoga Mats', 'og:image:height': '630', 'fb:pages': '237865036265136', 'og:description': ""If you've ever felt the pain of a hardwood floor against your knees in Table Top Pose, you've probably realized the importance of a well-cushioned foundation. That being said, the best thick yoga mats aren't just about thickness. They combine all…"", 'referrer': 'unsafe-url', 'fb:app_id': '378366428966386', 'twitter:site': '@elitedaily', 'viewport': 'width=device-width,initial-scale=1', 'og:url': 'https://www.elitedaily.com/p/the-6-best-thick-yoga-mats-12010354'}]",,,,,,,,,,,,,,,,,,,,,,,,"width=device-width,initial-scale=1","If you've ever felt the pain of a hardwood floor against your knees in Table Top Pose, you've probably realized the importance of a well-cushioned foundation. That being said, the best thick yoga mats aren't just about thickness. They combine all…",https://imgix.bustle.com/uploads/image/2018/9/24/d497a07f-6d7e-4bc7-8d84-253310f3ac99-best-extra-thick-yoga-mats.jpg?w=1200&h=630&q=70&fit=crop&crop=faces&fm=jpg,The 6 Best Thick Yoga Mats,https://www.elitedaily.com/p/the-6-best-thick-yoga-mats-12010354,,,,,,,,,,,,378366428966386,630,1200,Elite Daily,article,,,,,,,,,,,,,,,,summary_large_image,,,,,@elitedaily,,,,,,,,,,,,,,,,,,unsafe-url,,237865036265136,,,,,,,,,,,,,,,,,,,,,,,,,,,,,,,,,,,,,,,,,,,,,,,,
thick yoga mats,2,12 Best Yoga Mats 2019 | The Strategist | New York Magazine,"Dec 17, 2019 ... We found the best yoga mats on Amazon for every kind of yogi. Featuring an 
extra-thick mat that's easy on bad knees, the best mat for ...",nymag.com,https://nymag.com/strategist/article/best-yoga-mats.html,2020-02-22 20:08:28.103705+00:00,13100000,,10,PySearch,012859022920491477448:pubdbfjmmec,0.36,"13,100,000",https://nymag.com/strategist/article/best-yoga-mats.html,https://nymag.com/strategist/article/best-<b>yoga</b>-<b>mats</b>.html,"Dec 17, 2019 <b>...</b> We found the best <b>yoga mats</b> on Amazon for every kind of yogi. Featuring an <br>
extra-<b>thick</b> mat that&#39;s easy on bad knees, the best mat for&nbsp;...",12 Best <b>Yoga Mats</b> 2019 | The Strategist | New York Magazine,utf8,customsearch#result,utf8,"{'imageobject': [{'width': '600', 'url': 'http://nymag.com/strategist/media/sites/strategist/logo.w600.h60.png', 'height': '60'}, {'width': '1200', 'url': 'https://pixel.nymag.com/imgs/daily/strategist/2018/01/09/yoga-mats/09-yoga-mat-lede.w1200.h630.jpg', 'height': '630'}], 'person': [{'name': 'The Editors', 'sameas': 'https://nymag.com/author/the-editors'}], 'organization': [{'name': 'The Strategist', 'sameas': 'http://nymag.com/strategist'}], 'metatags': [{'og:image': 'https://pixel.nymag.com/imgs/daily/strategist/2018/01/09/yoga-mats/09-yoga-mat-lede.w1200.h630.jpg', 'article:published_time': '2019-12-17T13:10:00.000-05:00', 'twitter:card': 'summary_large_image', 'sailthru.tags': ""the strategist, people's choice, health and fitness, sporting goods, yoga"", 'og:site_name': 'The Strategist', 'apple-mobile-web-app-title': 'The Strategist', 'vertical': 'The Strategist', 'type': 'Article', 'msapplication-tileimage': 'https://assets.nymag.com/media/sites/strategist/icon.144x144.png', 'og:description': '“This mat has changed my yoga life completely.”', 'twitter:image': 'https://pixel.nymag.com/imgs/daily/strategist/2018/01/09/yoga-mats/09-yoga-mat-lede.w600.h315.2x.jpg', 'article:publisher': 'https://www.facebook.com/nymagstrategist', 'twitter:site': '@strategist', 'application-name': 'The Strategist', 'msapplication-tilecolor': '#111', 'twitter:title': 'The Best Yoga Mats on Amazon, According to Reviewers', 'og:type': 'article', 'author': 'The Editors', 'og:title': 'The Best Yoga Mats on Amazon, According to Hyperenthusiastic Reviewers', 'article:tag': ""the strategist, people's choice, health and fitness, sporting goods, yoga"", 'fb:app_id': '1782502952000064', 'viewport': 'width=device-width,initial-scale=1,shrink-to-fit=no', 'twitter:description': '“This mat has changed my yoga life completely.”', 'og:url': 'https://nymag.com/strategist/article/best-yoga-mats.html', 'article:opinion': 'true'}], 'cse_image': [{'src': 'https://pixel.nymag.com/imgs/daily/strategist/2018/01/09/yoga-mats/09-yoga-mat-lede.w1200.h630.jpg'}], 'article': [{'articlebody': 'Photo: ChinaFotoPress/VCG via Getty Images Here at the Strategist, we like to think of ourselves as crazy (in the good way) about the stuff we buy, but as much as we’d like to, we can’t...', 'articlesection': 'Health & Fitness', 'headline': 'The Best Yoga Mats on Amazon, According to Hyperenthusiastic Reviewers', 'url': 'http://nymag.com/strategist/article/best-yoga-mats.html', 'datepublished': '2019-12-17T13:10:00.000-05:00', 'mainentityofpage': 'http://nymag.com/strategist/article/best-yoga-mats.html'}]}",off,0.357634,1,[{'src': 'https://pixel.nymag.com/imgs/daily/strategist/2018/01/09/yoga-mats/09-yoga-mat-lede.w1200.h630.jpg'}],,"[{'og:image': 'https://pixel.nymag.com/imgs/daily/strategist/2018/01/09/yoga-mats/09-yoga-mat-lede.w1200.h630.jpg', 'article:published_time': '2019-12-17T13:10:00.000-05:00', 'twitter:card': 'summary_large_image', 'sailthru.tags': ""the strategist, people's choice, health and fitness, sporting goods, yoga"", 'og:site_name': 'The Strategist', 'apple-mobile-web-app-title': 'The Strategist', 'vertical': 'The Strategist', 'type': 'Article', 'msapplication-tileimage': 'https://assets.nymag.com/media/sites/strategist/icon.144x144.png', 'og:description': '“This mat has changed my yoga life completely.”', 'twitter:image': 'https://pixel.nymag.com/imgs/daily/strategist/2018/01/09/yoga-mats/09-yoga-mat-lede.w600.h315.2x.jpg', 'article:publisher': 'https://www.facebook.com/nymagstrategist', 'twitter:site': '@strategist', 'application-name': 'The Strategist', 'msapplication-tilecolor': '#111', 'twitter:title': 'The Best Yoga Mats on Amazon, According to Reviewers', 'og:type': 'article', 'author': 'The Editors', 'og:title': 'The Best Yoga Mats on Amazon, According to Hyperenthusiastic Reviewers', 'article:tag': ""the strategist, people's choice, health and fitness, sporting goods, yoga"", 'fb:app_id': '1782502952000064', 'viewport': 'width=device-width,initial-scale=1,shrink-to-fit=no', 'twitter:description': '“This mat has changed my yoga life completely.”', 'og:url': 'https://nymag.com/strategist/article/best-yoga-mats.html', 'article:opinion': 'true'}]",,"[{'width': '600', 'url': 'http://nymag.com/strategist/media/sites/strategist/logo.w600.h60.png', 'height': '60'}, {'width': '1200', 'url': 'https://pixel.nymag.com/imgs/daily/strategist/2018/01/09/yoga-mats/09-yoga-mat-lede.w1200.h630.jpg', 'height': '630'}]","[{'name': 'The Editors', 'sameas': 'https://nymag.com/author/the-editors'}]",,,,,,,,,,,"[{'articlebody': 'Photo: ChinaFotoPress/VCG via Getty Images Here at the Strategist, we like to think of ourselves as crazy (in the good way) about the stuff we buy, but as much as we’d like to, we can’t...', 'articlesection': 'Health & Fitness', 'headline': 'The Best Yoga Mats on Amazon, According to Hyperenthusiastic Reviewers', 'url': 'http://nymag.com/strategist/article/best-yoga-mats.html', 'datepublished': '2019-12-17T13:10:00.000-05:00', 'mainentityofpage': 'http://nymag.com/strategist/article/best-yoga-mats.html'}]","[{'name': 'The Strategist', 'sameas': 'http://nymag.com/strategist'}]",,,,,,,,,"width=device-width,initial-scale=1,shrink-to-fit=no",“This mat has changed my yoga life completely.”,https://pixel.nymag.com/imgs/daily/strategist/2018/01/09/yoga-mats/09-yoga-mat-lede.w1200.h630.jpg,"The Best Yoga Mats on Amazon, According to Hyperenthusiastic Reviewers",https://nymag.com/strategist/article/best-yoga-mats.html,,,,,,,,,,,,1782502952000064,,,The Strategist,article,,,,,,,,,,,,,,,,summary_large_image,https://pixel.nymag.com/imgs/daily/strategist/2018/01/09/yoga-mats/09-yoga-mat-lede.w600.h315.2x.jpg,,,,@strategist,"The Best Yoga Mats on Amazon, According to Reviewers",,,“This mat has changed my yoga life completely.”,,The Editors,,,,,,,,,,,,,,,The Strategist,The Strategist,true,2019-12-17T13:10:00.000-05:00,https://www.facebook.com/nymagstrategist,"the strategist, people's choice, health and fitness, sporting goods, yoga",#111,https://assets.nymag.com/media/sites/strategist/icon.144x144.png,"the strategist, people's choice, health and fitness, sporting goods, yoga",Article,The Strategist,,,,,,,,,,,,,,,,,,,,,,,,,,,,,,,,,,,,,
thick yoga mats,3,Crown Sporting Goods 5/8-Inch Extra Thick Yoga Mat ... - Amazon.com,"Amazon.com : Crown Sporting Goods 5/8-Inch Extra Thick Yoga Mat with No 
Stick Ridge, Black : Sports & Outdoors.",www.amazon.com,https://www.amazon.com/Crown-Sporting-Goods-8-Inch-Extra/dp/B00M0ETE8S,2020-02-22 20:08:28.103705+00:00,13100000,1TdvYH7in2IJ,10,PySearch,012859022920491477448:pubdbfjmmec,0.36,"13,100,000",https://www.amazon.com/Crown-Sporting-Goods-8-Inch.../B00M0ETE8S,https://www.amazon.com/Crown-Sporting-Goods-8-Inch.../B00M0ETE8S,"Amazon.com : Crown Sporting Goods 5/8-Inch Extra <b>Thick Yoga Mat</b> with No <br>
Stick Ridge, Black : Sports &amp; Outdoors.",Crown Sporting Goods 5/8-Inch Extra Thick Yoga Mat ... - Amazon.com,utf8,customsearch#result,utf8,"{'scraped': [{'image_link': 'https://images-na.ssl-images-amazon.com/images/I/61VgID7jkDL._AC_SY355_.jpg'}], 'cse_thumbnail': [{'src': 'https://encrypted-tbn0.gstatic.com/images?q=tbn:ANd9GcT-xKEh7j7pD50OXT8nNPJ3di5oumPRwi_PbTwX111YfRs3aRo5HSuQNitX', 'width': '322', 'height': '157'}], 'metatags': [{'og:image': 'https://images-na.ssl-images-amazon.com/images/I/41gXu45B%2B3L._SR600%2c315_PIWhiteStrip%2cBottomLeft%2c0%2c35_PIAmznPrime%2cBottomLeft%2c0%2c-5_PIStarRatingFOURANDHALF%2cBottomLeft%2c360%2c-6_SR600%2c315_ZA(813%20Reviews)%2c445%2c291%2c400%2c400%2carial%2c12%2c4%2c0%2c0%2c5_SCLZZZZZZZ_.jpg', 'og:title': 'Crown Sporting Goods 5/8-Inch Extra Thick Yoga Mat with No Stick Ridge, Black', 'og:url': 'http://www.amazon.com/dp/B00LY8TG3Y/ref=tsm_1_fb_lk', 'title': 'Amazon.com : Crown Sporting Goods 5/8-Inch Extra Thick Yoga Mat with No Stick Ridge, Black : Sports & Outdoors', 'og:description': ""If you need a comfortable surface for Pilates, Yoga or other floor exercises, this high-density foam mat is the solution. Unlike our competitors, our mat measures 16 mm thick, which is almost 5/8 inches. The mat's ridged texture creates a cooling, non-stick, moisture-resistant surface so you can ...""}], 'cse_image': [{'src': 'https://images-na.ssl-images-amazon.com/images/I/61VgID7jkDL._AC_SY355_.jpg'}]}",off,0.357634,1,[{'src': 'https://images-na.ssl-images-amazon.com/images/I/61VgID7jkDL._AC_SY355_.jpg'}],"[{'src': 'https://encrypted-tbn0.gstatic.com/images?q=tbn:ANd9GcT-xKEh7j7pD50OXT8nNPJ3di5oumPRwi_PbTwX111YfRs3aRo5HSuQNitX', 'width': '322', 'height': '157'}]","[{'og:image': 'https://images-na.ssl-images-amazon.com/images/I/41gXu45B%2B3L._SR600%2c315_PIWhiteStrip%2cBottomLeft%2c0%2c35_PIAmznPrime%2cBottomLeft%2c0%2c-5_PIStarRatingFOURANDHALF%2cBottomLeft%2c360%2c-6_SR600%2c315_ZA(813%20Reviews)%2c445%2c291%2c400%2c400%2carial%2c12%2c4%2c0%2c0%2c5_SCLZZZZZZZ_.jpg', 'og:title': 'Crown Sporting Goods 5/8-Inch Extra Thick Yoga Mat with No Stick Ridge, Black', 'og:url': 'http://www.amazon.com/dp/B00LY8TG3Y/ref=tsm_1_fb_lk', 'title': 'Amazon.com : Crown Sporting Goods 5/8-Inch Extra Thick Yoga Mat with No Stick Ridge, Black : Sports & Outdoors', 'og:description': ""If you need a comfortable surface for Pilates, Yoga or other floor exercises, this high-density foam mat is the solution. Unlike our competitors, our mat measures 16 mm thick, which is almost 5/8 inches. The mat's ridged texture creates a cooling, non-stick, moisture-resistant surface so you can ...""}]",[{'image_link': 'https://images-na.ssl-images-amazon.com/images/I/61VgID7jkDL._AC_SY355_.jpg'}],,,,,,,,,,,,,,,,,,,,,,,,"If you need a comfortable surface for Pilates, Yoga or other floor exercises, this high-density foam mat is the solution. Unlike our competitors, our mat measures 16 mm thick, which is almost 5/8 inches. The mat's ridged texture creates a cooling, non-stick, moisture-resistant surface so you can ...",https://images-na.ssl-images-amazon.com/images/I/41gXu45B%2B3L._SR600%2c315_PIWhiteStrip%2cBottomLeft%2c0%2c35_PIAmznPrime%2cBottomLeft%2c0%2c-5_PIStarRatingFOURANDHALF%2cBottomLeft%2c360%2c-6_SR600%2c315_ZA(813%20Reviews)%2c445%2c291%2c400%2c400%2carial%2c12%2c4%2c0%2c0%2c5_SCLZZZZZZZ_.jpg,"Crown Sporting Goods 5/8-Inch Extra Thick Yoga Mat with No Stick Ridge, Black",http://www.amazon.com/dp/B00LY8TG3Y/ref=tsm_1_fb_lk,"Amazon.com : Crown Sporting Goods 5/8-Inch Extra Thick Yoga Mat with No Stick Ridge, Black : Sports & Outdoors",,,,,,,,,,,,,,,,,,,,,,,,,,,,,,,,,,,,,,,,,,,,,,,,,,,,,,,,,,,,,,,,,,,,,,,,,,,,,,,,,,,,,,,,,,,,,,,,,,,,,,,,
thick yoga mats,4,"How to Choose the Best Yoga Mat with Texture, Sticky and Eco ...","Why it's important: The thickness of your yoga mat has a lot to do with how 
comfortable it is — too thin, and your knee may get banged up during crescent 
lunge.",www.gaiam.com,https://www.gaiam.com/blogs/discover/how-to-choose-the-right-yoga-mat,2020-02-22 20:08:28.103705+00:00,13100000,mO7Zj8OzYuwJ,10,PySearch,012859022920491477448:pubdbfjmmec,0.36,"13,100,000",https://www.gaiam.com/blogs/discover/how-to-choose-the-right-yoga-mat,https://www.gaiam.com/blogs/discover/how-to-choose-the-right-<b>yoga</b>-<b>mat</b>,"Why it&#39;s important: The <b>thickness</b> of your <b>yoga mat</b> has a lot to do with how <br>
comfortable it is — too thin, and your knee may get banged up during crescent <br>
lunge.","How to Choose the Best <b>Yoga Mat</b> with Texture, Sticky and Eco ...",utf8,customsearch#result,utf8,"{'cse_thumbnail': [{'src': 'https://encrypted-tbn0.gstatic.com/images?q=tbn:ANd9GcTXm9q-MeDwYToeGWo-dH_yRMUjKOVhsX5cV3cbAsn2L13QVaeTDf9QjnU', 'width': '275', 'height': '183'}], 'metatags': [{'og:image': 'http://cdn.shopify.com/s/files/1/1728/2157/articles/19_600x.jpg?v=1492018692', 'og:type': 'article', 'twitter:card': 'summary', 'twitter:title': 'How to Choose the Right Yoga Mat', 'theme-color': '#ffffff', 'og:site_name': 'Gaiam', 'handheldfriendly': 'True', 'author': 'Gaiam', 'og:title': 'How to Choose the Right Yoga Mat', 'shopify-checkout-api-token': '85eef41d2cea00216bf281e27354a9e5', 'og:description': 'Get help choosing the best yoga mat for your style of yoga and your lifestyle, goals, likes, pet peeves and eco-ideals.', 'og:image:secure_url': 'https://cdn.shopify.com/s/files/1/1728/2157/articles/19_600x.jpg?v=1492018692', 'twitter:image': 'http://cdn.shopify.com/s/files/1/1728/2157/articles/19_600x.jpg?v=1492018692', 'viewport': 'width=device-width,initial-scale=1', 'twitter:description': 'Get help choosing the best yoga mat for your style of yoga and your lifestyle, goals, likes, pet peeves and eco-ideals.', 'shopify-digital-wallet': '/17282157/digital_wallets/dialog', 'mobileoptimized': '320', 'og:url': 'https://www.gaiam.com/blogs/discover/how-to-choose-the-right-yoga-mat'}], 'cse_image': [{'src': 'http://cdn.shopify.com/s/files/1/1728/2157/articles/19_600x.jpg?v=1492018692'}]}",off,0.357634,1,[{'src': 'http://cdn.shopify.com/s/files/1/1728/2157/articles/19_600x.jpg?v=1492018692'}],"[{'src': 'https://encrypted-tbn0.gstatic.com/images?q=tbn:ANd9GcTXm9q-MeDwYToeGWo-dH_yRMUjKOVhsX5cV3cbAsn2L13QVaeTDf9QjnU', 'width': '275', 'height': '183'}]","[{'og:image': 'http://cdn.shopify.com/s/files/1/1728/2157/articles/19_600x.jpg?v=1492018692', 'og:type': 'article', 'twitter:card': 'summary', 'twitter:title': 'How to Choose the Right Yoga Mat', 'theme-color': '#ffffff', 'og:site_name': 'Gaiam', 'handheldfriendly': 'True', 'author': 'Gaiam', 'og:title': 'How to Choose the Right Yoga Mat', 'shopify-checkout-api-token': '85eef41d2cea00216bf281e27354a9e5', 'og:description': 'Get help choosing the best yoga mat for your style of yoga and your lifestyle, goals, likes, pet peeves and eco-ideals.', 'og:image:secure_url': 'https://cdn.shopify.com/s/files/1/1728/2157/articles/19_600x.jpg?v=1492018692', 'twitter:image': 'http://cdn.shopify.com/s/files/1/1728/2157/articles/19_600x.jpg?v=1492018692', 'viewport': 'width=device-width,initial-scale=1', 'twitter:description': 'Get help choosing the best yoga mat for your style of yoga and your lifestyle, goals, likes, pet peeves and eco-ideals.', 'shopify-digital-wallet': '/17282157/digital_wallets/dialog', 'mobileoptimized': '320', 'og:url': 'https://www.gaiam.com/blogs/discover/how-to-choose-the-right-yoga-mat'}]",,,,,,,,,,,,,,,,,,,,,,85eef41d2cea00216bf281e27354a9e5,/17282157/digital_wallets/dialog,"width=device-width,initial-scale=1","Get help choosing the best yoga mat for your style of yoga and your lifestyle, goals, likes, pet peeves and eco-ideals.",http://cdn.shopify.com/s/files/1/1728/2157/articles/19_600x.jpg?v=1492018692,How to Choose the Right Yoga Mat,https://www.gaiam.com/blogs/discover/how-to-choose-the-right-yoga-mat,,,,,,,,,,,,,,,Gaiam,article,,,,,,#ffffff,,,,,,,,,,summary,http://cdn.shopify.com/s/files/1/1728/2157/articles/19_600x.jpg?v=1492018692,,,,,How to Choose the Right Yoga Mat,,https://cdn.shopify.com/s/files/1/1728/2157/articles/19_600x.jpg?v=1492018692,"Get help choosing the best yoga mat for your style of yoga and your lifestyle, goals, likes, pet peeves and eco-ideals.",,Gaiam,,,,,,,,,,,,,,,,,,,,,,,,,,True,320,,,,,,,,,,,,,,,,,,,,,,,,,,,,,,,,,,,
thick yoga mats,5,Yoga Mat Extra Thick Wide and Long: Amazon.com,"Manduka PRO Yoga Mat – Premium 6mm Thick Mat, Eco Friendly, Oeko-Tex 
Certified, Chemical Free, High Performance Grip, Ultra Dense Cushioning for ...",www.amazon.com,https://www.amazon.com/slp/yoga-mat-extra-thick-wide-and-long/47rb9rzxcjgr7hj,2020-02-22 20:08:28.103705+00:00,13100000,bXm2NEwXNR4J,10,PySearch,012859022920491477448:pubdbfjmmec,0.36,"13,100,000",https://www.amazon.com/slp/yoga-mat-extra-thick-wide.../47rb9rzxcjgr7hj,https://www.amazon.com/slp/<b>yoga</b>-<b>mat</b>-extra-<b>thick</b>-wide.../47rb9rzxcjgr7hj,"Manduka PRO <b>Yoga Mat</b> – Premium 6mm <b>Thick</b> Mat, Eco Friendly, Oeko-Tex <br>
Certified, Chemical Free, High Performance Grip, Ultra Dense Cushioning for&nbsp;...",<b>Yoga Mat</b> Extra <b>Thick</b> Wide and Long: Amazon.com,utf8,customsearch#result,utf8,"{'cse_thumbnail': [{'src': 'https://encrypted-tbn0.gstatic.com/images?q=tbn:ANd9GcSYGQDNsxeKOCKOVq2lDrWXrKOo0dAU_Tjt_3Tfk9EH1DpSKUcAR2NZnlk', 'width': '225', 'height': '225'}], 'metatags': [{'viewport': 'width=device-width, maximum-scale=1, minimum-scale=1, initial-scale=1, user-scalable=no, shrink-to-fit=no'}], 'cse_image': [{'src': 'https://m.media-amazon.com/images/I/61pIU6kvh1L._SR500,500_.jpg'}]}",off,0.357634,1,"[{'src': 'https://m.media-amazon.com/images/I/61pIU6kvh1L._SR500,500_.jpg'}]","[{'src': 'https://encrypted-tbn0.gstatic.com/images?q=tbn:ANd9GcSYGQDNsxeKOCKOVq2lDrWXrKOo0dAU_Tjt_3Tfk9EH1DpSKUcAR2NZnlk', 'width': '225', 'height': '225'}]","[{'viewport': 'width=device-width, maximum-scale=1, minimum-scale=1, initial-scale=1, user-scalable=no, shrink-to-fit=no'}]",,,,,,,,,,,,,,,,,,,,,,,,"width=device-width, maximum-scale=1, minimum-scale=1, initial-scale=1, user-scalable=no, shrink-to-fit=no",,,,,,,,,,,,,,,,,,,,,,,,,,,,,,,,,,,,,,,,,,,,,,,,,,,,,,,,,,,,,,,,,,,,,,,,,,,,,,,,,,,,,,,,,,,,,,,,,,,,,,,,,,,,,
