searchTerms,rank,title,snippet,displayLink,link,queryTime,totalResults,cacheId,count,cseName,cx,formattedSearchTime,formattedTotalResults,formattedUrl,htmlFormattedUrl,htmlSnippet,htmlTitle,inputEncoding,kind,outputEncoding,pagemap,safe,searchTime,startIndex,cse_image,cse_thumbnail,metatags,scraped,imageobject,person,videoobject,listitem,aggregaterating,answer,brand,hreview,product,question,rating,review,article,organization,hcard,speakablespecification,thumbnail,Breadcrumb,hproduct,format-detection,shopify-checkout-api-token,shopify-digital-wallet,viewport,og:description,og:image,og:title,og:url,metatag_title,apple-mobile-web-app-capable,pagegroup,pageid,al:android:app_name,al:android:package,al:android:url,al:ios:app_name,al:ios:app_store_id,al:ios:url,al:web:url,fb:app_id,og:image:height,og:image:width,og:site_name,og:type,og:video:height,og:video:secure_url,og:video:type,og:video:url,og:video:width,theme-color,twitter:app:id:googleplay,twitter:app:id:ipad,twitter:app:id:iphone,twitter:app:name:googleplay,twitter:app:name:ipad,twitter:app:name:iphone,twitter:app:url:googleplay,twitter:app:url:ipad,twitter:app:url:iphone,twitter:card,twitter:image,twitter:player,twitter:player:height,twitter:player:width,twitter:site,twitter:title,twitter:url,og:image:secure_url,twitter:description,apple-itunes-app,author,bvdatemodified,copyright,og:locale,product:brand,product:category,product:condition,product:product_link,product:retailer,product:retailer_category,product:retailer_part_no,product:retailer_title,referrer,twitter:creator,fb:pages,apple-mobile-web-app-title,application-name,article:opinion,article:published_time,article:publisher,article:tag,msapplication-tilecolor,msapplication-tileimage,sailthru.tags,type,vertical,handheldfriendly,mobileoptimized,article:modified_time,article:section,auto-publish,m1,m2,msapplication-tap-highlight,sailthru.contenttype,sailthru.date,sailthru.image.full,sailthru.image.thumb,sailthru.socialtitle,metatag_thumbnail,x-ua-compatible,og:phone_number,msvalidate.01,oath:guce:consent-host,oath:guce:inline-consent,oath:guce:locale,oath:guce:product-eu,og:image:type,og:image:url,taboola.category,twitter:image:height,twitter:image:width,article:content_tier,date,linkedin:owner,msapplication-config,news_keywords,sailthru.author,sailthru.description,sailthru.title,sailthru.verticals,tbi-vertical,pageidentifier
manduka yoga mats,1,"High Quality Yoga Mats, Gear, and Clothing - Manduka Online Store","Manduka yoga mats, apparel and accessories are designed by yogis and trusted 
by teachers worldwide. Our yoga mats and yoga products are crafted for high ...",www.manduka.com,https://www.manduka.com/,2020-02-22 20:08:28.094930+00:00,1110000,wSf_tELTgYkJ,10,PySearch,012859022920491477448:pubdbfjmmec,0.34,"1,110,000",https://www.manduka.com/,https://www.<b>manduka</b>.com/,"<b>Manduka yoga mats</b>, apparel and accessories are designed by yogis and trusted <br>
by teachers worldwide. Our yoga mats and yoga products are crafted for high&nbsp;...","High Quality <b>Yoga Mats</b>, Gear, and Clothing - <b>Manduka</b> Online Store",utf8,customsearch#result,utf8,"{'cse_thumbnail': [{'src': 'https://encrypted-tbn0.gstatic.com/images?q=tbn:ANd9GcT6zGuiVhSlLWY2fC1rTVeojDa7JSjqzIwEfI4RRUvNNl3FuE37XHOmEDu7', 'width': '196', 'height': '258'}], 'metatags': [{'viewport': 'width=device-width, initial-scale=1.0, maximum-scale=1.0, user-scalable=no', 'shopify-digital-wallet': '/13235290170/digital_wallets/dialog', 'shopify-checkout-api-token': '8b9adab632ab78b0c48e114307b28cfa', 'format-detection': 'telephone=no'}], 'cse_image': [{'src': 'https://cdn.shopify.com/s/files/1/0132/3529/0170/files/01102020-New-Hardgoods-Homepage-Banner-Mobile_350x400.jpg?v=1578685058'}]}",off,0.338409,1,[{'src': 'https://cdn.shopify.com/s/files/1/0132/3529/0170/files/01102020-New-Hardgoods-Homepage-Banner-Mobile_350x400.jpg?v=1578685058'}],"[{'src': 'https://encrypted-tbn0.gstatic.com/images?q=tbn:ANd9GcT6zGuiVhSlLWY2fC1rTVeojDa7JSjqzIwEfI4RRUvNNl3FuE37XHOmEDu7', 'width': '196', 'height': '258'}]","[{'viewport': 'width=device-width, initial-scale=1.0, maximum-scale=1.0, user-scalable=no', 'shopify-digital-wallet': '/13235290170/digital_wallets/dialog', 'shopify-checkout-api-token': '8b9adab632ab78b0c48e114307b28cfa', 'format-detection': 'telephone=no'}]",,,,,,,,,,,,,,,,,,,,,telephone=no,8b9adab632ab78b0c48e114307b28cfa,/13235290170/digital_wallets/dialog,"width=device-width, initial-scale=1.0, maximum-scale=1.0, user-scalable=no",,,,,,,,,,,,,,,,,,,,,,,,,,,,,,,,,,,,,,,,,,,,,,,,,,,,,,,,,,,,,,,,,,,,,,,,,,,,,,,,,,,,,,,,,,,,,,,,,,,,,,,,,,,,,
manduka yoga mats,2,Manduka PRO Yoga Mat - Premium 6mm Thick Mat ... - Amazon.com,"LIFETIME WARRANTY: Guaranteed to last a lifetime! The superior quality of the 
PRO series yoga mat will never peel, flake, or fade. Otherwise, we'll replace it!",www.amazon.com,https://www.amazon.com/Manduka-PRO-Yoga-Mat-Performance/dp/B078VJ81M2,2020-02-22 20:08:28.094930+00:00,1110000,DG7oAw2sf_kJ,10,PySearch,012859022920491477448:pubdbfjmmec,0.34,"1,110,000",https://www.amazon.com/Manduka-PRO-Yoga-Mat.../dp/B078VJ81M2,https://www.amazon.com/<b>Manduka</b>-PRO-<b>Yoga</b>-<b>Mat</b>.../dp/B078VJ81M2,"LIFETIME WARRANTY: Guaranteed to last a lifetime! The superior quality of the <br>
PRO series <b>yoga mat</b> will never peel, flake, or fade. Otherwise, we&#39;ll replace it!",Manduka PRO Yoga Mat - Premium 6mm Thick Mat ... - Amazon.com,utf8,customsearch#result,utf8,"{'scraped': [{'image_link': 'https://images-na.ssl-images-amazon.com/images/I/61pIU6kvh1L._AC_SY355_.jpg'}], 'cse_thumbnail': [{'src': 'https://encrypted-tbn2.gstatic.com/images?q=tbn:ANd9GcTekEmYVucqZyHrz4QNOJkKSaZXbSqNzCfUWih4LeyQOG8dbz0qEanEK0g', 'width': '228', 'height': '221'}], 'metatags': [{'og:image': 'https://images-na.ssl-images-amazon.com/images/I/41bHuy%2Be3PL._SR600%2c315_PIWhiteStrip%2cBottomLeft%2c0%2c35_PIStarRatingFOURANDHALF%2cBottomLeft%2c360%2c-6_SR600%2c315_ZA(2065%20Reviews)%2c445%2c291%2c400%2c400%2carial%2c12%2c4%2c0%2c0%2c5_SCLZZZZZZZ_.jpg', 'og:title': 'Manduka PRO Yoga Mat - Premium 6mm Thick Mat, Eco Friendly, Oeko-Tex Certified, Chemical Free, High Performance Grip, Ultra Dense Cushioning for Support and Stability in Yoga, Pilates, Gym and Fitness', 'og:url': 'http://www.amazon.com/dp/B078VJ81M2/ref=tsm_1_fb_lk', 'title': 'Amazon.com : Manduka PRO Yoga Mat - Premium 6mm Thick Mat, Eco Friendly, Oeko-Tex Certified, Chemical Free, High Performance Grip, Ultra Dense Cushioning for Support and Stability in Yoga, Pilates, Gym and Fitness : Sports & Outdoors', 'og:description': 'Designed to last a lifetime (or two), Manduka PRO series yoga mats curb the amount of PVC mats that enter landfills every year and reduces overall mat consumption. During the manufacturing of most PVC products, toxic emissions may be released into the air. However, PRO series mats are manufacture...'}], 'cse_image': [{'src': 'https://images-na.ssl-images-amazon.com/images/I/61pIU6kvh1L._AC_SY355_.jpg'}]}",off,0.338409,1,[{'src': 'https://images-na.ssl-images-amazon.com/images/I/61pIU6kvh1L._AC_SY355_.jpg'}],"[{'src': 'https://encrypted-tbn2.gstatic.com/images?q=tbn:ANd9GcTekEmYVucqZyHrz4QNOJkKSaZXbSqNzCfUWih4LeyQOG8dbz0qEanEK0g', 'width': '228', 'height': '221'}]","[{'og:image': 'https://images-na.ssl-images-amazon.com/images/I/41bHuy%2Be3PL._SR600%2c315_PIWhiteStrip%2cBottomLeft%2c0%2c35_PIStarRatingFOURANDHALF%2cBottomLeft%2c360%2c-6_SR600%2c315_ZA(2065%20Reviews)%2c445%2c291%2c400%2c400%2carial%2c12%2c4%2c0%2c0%2c5_SCLZZZZZZZ_.jpg', 'og:title': 'Manduka PRO Yoga Mat - Premium 6mm Thick Mat, Eco Friendly, Oeko-Tex Certified, Chemical Free, High Performance Grip, Ultra Dense Cushioning for Support and Stability in Yoga, Pilates, Gym and Fitness', 'og:url': 'http://www.amazon.com/dp/B078VJ81M2/ref=tsm_1_fb_lk', 'title': 'Amazon.com : Manduka PRO Yoga Mat - Premium 6mm Thick Mat, Eco Friendly, Oeko-Tex Certified, Chemical Free, High Performance Grip, Ultra Dense Cushioning for Support and Stability in Yoga, Pilates, Gym and Fitness : Sports & Outdoors', 'og:description': 'Designed to last a lifetime (or two), Manduka PRO series yoga mats curb the amount of PVC mats that enter landfills every year and reduces overall mat consumption. During the manufacturing of most PVC products, toxic emissions may be released into the air. However, PRO series mats are manufacture...'}]",[{'image_link': 'https://images-na.ssl-images-amazon.com/images/I/61pIU6kvh1L._AC_SY355_.jpg'}],,,,,,,,,,,,,,,,,,,,,,,,"Designed to last a lifetime (or two), Manduka PRO series yoga mats curb the amount of PVC mats that enter landfills every year and reduces overall mat consumption. During the manufacturing of most PVC products, toxic emissions may be released into the air. However, PRO series mats are manufacture...",https://images-na.ssl-images-amazon.com/images/I/41bHuy%2Be3PL._SR600%2c315_PIWhiteStrip%2cBottomLeft%2c0%2c35_PIStarRatingFOURANDHALF%2cBottomLeft%2c360%2c-6_SR600%2c315_ZA(2065%20Reviews)%2c445%2c291%2c400%2c400%2carial%2c12%2c4%2c0%2c0%2c5_SCLZZZZZZZ_.jpg,"Manduka PRO Yoga Mat - Premium 6mm Thick Mat, Eco Friendly, Oeko-Tex Certified, Chemical Free, High Performance Grip, Ultra Dense Cushioning for Support and Stability in Yoga, Pilates, Gym and Fitness",http://www.amazon.com/dp/B078VJ81M2/ref=tsm_1_fb_lk,"Amazon.com : Manduka PRO Yoga Mat - Premium 6mm Thick Mat, Eco Friendly, Oeko-Tex Certified, Chemical Free, High Performance Grip, Ultra Dense Cushioning for Support and Stability in Yoga, Pilates, Gym and Fitness : Sports & Outdoors",,,,,,,,,,,,,,,,,,,,,,,,,,,,,,,,,,,,,,,,,,,,,,,,,,,,,,,,,,,,,,,,,,,,,,,,,,,,,,,,,,,,,,,,,,,,,,,,,,,,,,,,
manduka yoga mats,3,Yoga Mats - Find the Perfect Yoga Mat for Your Practice | Manduka,"Take the Mat Quiz PRO Yoga Mats The original Manduka mat. Premium 
materials, superior performance, an elevated practice. #1 Recommended High ...",www.manduka.com,https://www.manduka.com/pages/collections-yoga-mats,2020-02-22 20:08:28.094930+00:00,1110000,1wWRNe6J8c0J,10,PySearch,012859022920491477448:pubdbfjmmec,0.34,"1,110,000",https://www.manduka.com/pages/collections-yoga-mats,https://www.<b>manduka</b>.com/pages/collections-<b>yoga</b>-<b>mats</b>,"Take the Mat Quiz PRO <b>Yoga Mats</b> The original <b>Manduka</b> mat. Premium <br>
materials, superior performance, an elevated practice. #1 Recommended High&nbsp;...",<b>Yoga Mats</b> - Find the Perfect <b>Yoga Mat</b> for Your Practice | <b>Manduka</b>,utf8,customsearch#result,utf8,"{'metatags': [{'viewport': 'width=device-width, initial-scale=1.0, maximum-scale=1.0, user-scalable=no', 'shopify-digital-wallet': '/13235290170/digital_wallets/dialog', 'shopify-checkout-api-token': '8b9adab632ab78b0c48e114307b28cfa', 'format-detection': 'telephone=no'}]}",off,0.338409,1,,,"[{'viewport': 'width=device-width, initial-scale=1.0, maximum-scale=1.0, user-scalable=no', 'shopify-digital-wallet': '/13235290170/digital_wallets/dialog', 'shopify-checkout-api-token': '8b9adab632ab78b0c48e114307b28cfa', 'format-detection': 'telephone=no'}]",,,,,,,,,,,,,,,,,,,,,telephone=no,8b9adab632ab78b0c48e114307b28cfa,/13235290170/digital_wallets/dialog,"width=device-width, initial-scale=1.0, maximum-scale=1.0, user-scalable=no",,,,,,,,,,,,,,,,,,,,,,,,,,,,,,,,,,,,,,,,,,,,,,,,,,,,,,,,,,,,,,,,,,,,,,,,,,,,,,,,,,,,,,,,,,,,,,,,,,,,,,,,,,,,,
manduka yoga mats,4,Manduka Yoga Mats | Best Price Guarantee at DICK'S,"Shop Manduka yoga mats online today at DICK'S Sporting Goods. Find a better 
price somewhere else? We'll match it with our Best Price Guarantee!",www.dickssportinggoods.com,https://www.dickssportinggoods.com/f/manduka,2020-02-22 20:08:28.094930+00:00,1110000,EjKPD4KiLgkJ,10,PySearch,012859022920491477448:pubdbfjmmec,0.34,"1,110,000",https://www.dickssportinggoods.com/f/manduka,https://www.dickssportinggoods.com/f/<b>manduka</b>,"Shop <b>Manduka yoga mats</b> online today at DICK&#39;S Sporting Goods. Find a better <br>
price somewhere else? We&#39;ll match it with our Best Price Guarantee!",<b>Manduka Yoga Mats</b> | Best Price Guarantee at DICK&#39;S,utf8,customsearch#result,utf8,"{'cse_thumbnail': [{'src': 'https://encrypted-tbn2.gstatic.com/images?q=tbn:ANd9GcTT_OwQw94xhZSic2lY7p3gG920E9PKUdgVsqK65PYnUdKHuQdMSjbjqNM', 'width': '176', 'height': '176'}], 'metatags': [{'viewport': 'width=device-width, initial-scale=1.0', 'apple-mobile-web-app-capable': 'yes', 'pageid': '284282', 'pagegroup': 'Category'}], 'cse_image': [{'src': 'https://dks.scene7.com/is/image/dkscdn/15MDKUBLCKMTPRBLCEAC_Black_Magic_is/?$DSG_ProductCard$'}]}",off,0.338409,1,[{'src': 'https://dks.scene7.com/is/image/dkscdn/15MDKUBLCKMTPRBLCEAC_Black_Magic_is/?$DSG_ProductCard$'}],"[{'src': 'https://encrypted-tbn2.gstatic.com/images?q=tbn:ANd9GcTT_OwQw94xhZSic2lY7p3gG920E9PKUdgVsqK65PYnUdKHuQdMSjbjqNM', 'width': '176', 'height': '176'}]","[{'viewport': 'width=device-width, initial-scale=1.0', 'apple-mobile-web-app-capable': 'yes', 'pageid': '284282', 'pagegroup': 'Category'}]",,,,,,,,,,,,,,,,,,,,,,,,"width=device-width, initial-scale=1.0",,,,,,yes,Category,284282,,,,,,,,,,,,,,,,,,,,,,,,,,,,,,,,,,,,,,,,,,,,,,,,,,,,,,,,,,,,,,,,,,,,,,,,,,,,,,,,,,,,,,,,,,,,,,,,,,,,,
manduka yoga mats,5,"Yoga Sale - Yoga Mats, Clothing, Accessories on Clearance Sale ...","Yoga clearance sale! Find great deals on high performance Manduka yoga mats, 
clothing, and accessories. Shop our discounted selection of premium yoga ...",www.manduka.com,https://www.manduka.com/pages/sale-all-yoga-products,2020-02-22 20:08:28.094930+00:00,1110000,Zer6a-zdF6UJ,10,PySearch,012859022920491477448:pubdbfjmmec,0.34,"1,110,000",https://www.manduka.com/pages/sale-all-yoga-products,https://www.<b>manduka</b>.com/pages/sale-all-<b>yoga</b>-products,"Yoga clearance sale! Find great deals on high performance <b>Manduka yoga mats</b>, <br>
clothing, and accessories. Shop our discounted selection of premium yoga&nbsp;...","Yoga Sale - <b>Yoga Mats</b>, Clothing, Accessories on Clearance Sale ...",utf8,customsearch#result,utf8,"{'cse_thumbnail': [{'src': 'https://encrypted-tbn0.gstatic.com/images?q=tbn:ANd9GcRa0Rsf_OP-R9xwpKMt4Y3tVfvL8z-I7lDMrLzAgSgxZdrznTsEQb2FD-Y', 'width': '208', 'height': '242'}], 'metatags': [{'viewport': 'width=device-width, initial-scale=1.0, maximum-scale=1.0, user-scalable=no', 'shopify-digital-wallet': '/13235290170/digital_wallets/dialog', 'shopify-checkout-api-token': '8b9adab632ab78b0c48e114307b28cfa', 'format-detection': 'telephone=no'}], 'cse_image': [{'src': 'https://cdn.shopify.com/s/files/1/0132/3529/0170/products/PROlite-112091290-Mats-FW19-Maka-Color-Fields-01.jpg?v=1574299355'}]}",off,0.338409,1,[{'src': 'https://cdn.shopify.com/s/files/1/0132/3529/0170/products/PROlite-112091290-Mats-FW19-Maka-Color-Fields-01.jpg?v=1574299355'}],"[{'src': 'https://encrypted-tbn0.gstatic.com/images?q=tbn:ANd9GcRa0Rsf_OP-R9xwpKMt4Y3tVfvL8z-I7lDMrLzAgSgxZdrznTsEQb2FD-Y', 'width': '208', 'height': '242'}]","[{'viewport': 'width=device-width, initial-scale=1.0, maximum-scale=1.0, user-scalable=no', 'shopify-digital-wallet': '/13235290170/digital_wallets/dialog', 'shopify-checkout-api-token': '8b9adab632ab78b0c48e114307b28cfa', 'format-detection': 'telephone=no'}]",,,,,,,,,,,,,,,,,,,,,telephone=no,8b9adab632ab78b0c48e114307b28cfa,/13235290170/digital_wallets/dialog,"width=device-width, initial-scale=1.0, maximum-scale=1.0, user-scalable=no",,,,,,,,,,,,,,,,,,,,,,,,,,,,,,,,,,,,,,,,,,,,,,,,,,,,,,,,,,,,,,,,,,,,,,,,,,,,,,,,,,,,,,,,,,,,,,,,,,,,,,,,,,,,,
manduka yoga mats,6,Find Your Soul Mat: A Guide to All Manduka Yoga Mats - YouTube,"Oct 13, 2017 ... Find Your Soul Mat: A Guide to All Manduka Yoga Mats. Manduka Yoga. Loading
... Unsubscribe from Manduka Yoga? Cancel Unsubscribe.",www.youtube.com,https://www.youtube.com/watch?v=onfsTdy23DM,2020-02-22 20:08:28.094930+00:00,1110000,XaCTYSvDq64J,10,PySearch,012859022920491477448:pubdbfjmmec,0.34,"1,110,000",https://www.youtube.com/watch?v=onfsTdy23DM,https://www.youtube.com/watch?v=onfsTdy23DM,"Oct 13, 2017 <b>...</b> Find Your Soul Mat: A Guide to All <b>Manduka Yoga Mats</b>. Manduka Yoga. Loading<br>
... Unsubscribe from Manduka Yoga? Cancel Unsubscribe.",Find Your Soul Mat: A Guide to All <b>Manduka Yoga Mats</b> - YouTube,utf8,customsearch#result,utf8,"{'cse_thumbnail': [{'src': 'https://encrypted-tbn3.gstatic.com/images?q=tbn:ANd9GcR8g97T9Lo7TZb0IaxLkOSW7AIVXgmw3npAwM8zoY7ejJfEr8mexJJuSZ8N', 'width': '300', 'height': '168'}], 'imageobject': [{'width': '1280', 'url': 'https://i.ytimg.com/vi/onfsTdy23DM/maxresdefault.jpg', 'height': '720'}], 'person': [{'url': 'http://www.youtube.com/user/MandukaTV'}, {'url': 'https://plus.google.com/105363871791261892724'}], 'metatags': [{'og:image': 'https://i.ytimg.com/vi/onfsTdy23DM/maxresdefault.jpg', 'twitter:app:url:iphone': 'vnd.youtube://www.youtube.com/watch?v=onfsTdy23DM&feature=applinks', 'twitter:app:id:googleplay': 'com.google.android.youtube', 'theme-color': '#ff0000', 'og:image:width': '1280', 'twitter:card': 'player', 'og:site_name': 'YouTube', 'twitter:url': 'https://www.youtube.com/watch?v=onfsTdy23DM', 'twitter:app:url:ipad': 'vnd.youtube://www.youtube.com/watch?v=onfsTdy23DM&feature=applinks', 'al:android:package': 'com.google.android.youtube', 'twitter:app:name:googleplay': 'YouTube', 'title': 'Find Your Soul Mat: A Guide to All Manduka Yoga Mats', 'al:ios:url': 'vnd.youtube://www.youtube.com/watch?v=onfsTdy23DM&feature=applinks', 'twitter:app:id:iphone': '544007664', 'al:ios:app_store_id': '544007664', 'twitter:image': 'https://i.ytimg.com/vi/onfsTdy23DM/maxresdefault.jpg', 'twitter:player': 'https://www.youtube.com/embed/onfsTdy23DM', 'twitter:player:height': '720', 'twitter:site': '@youtube', 'og:video:type': 'text/html', 'og:video:height': '720', 'og:video:url': 'https://www.youtube.com/embed/onfsTdy23DM', 'og:type': 'video.other', 'twitter:title': 'Find Your Soul Mat: A Guide to All Manduka Yoga Mats', 'al:ios:app_name': 'YouTube', 'og:title': 'Find Your Soul Mat: A Guide to All Manduka Yoga Mats', 'og:image:height': '720', 'twitter:app:id:ipad': '544007664', 'al:web:url': 'https://www.youtube.com/watch?v=onfsTdy23DM&feature=applinks', 'og:video:secure_url': 'https://www.youtube.com/embed/onfsTdy23DM', 'og:video:width': '1280', 'al:android:url': 'vnd.youtube://www.youtube.com/watch?v=onfsTdy23DM&feature=applinks', 'fb:app_id': '87741124305', 'twitter:app:url:googleplay': 'https://www.youtube.com/watch?v=onfsTdy23DM', 'twitter:app:name:ipad': 'YouTube', 'og:url': 'https://www.youtube.com/watch?v=onfsTdy23DM', 'twitter:player:width': '1280', 'al:android:app_name': 'YouTube', 'twitter:app:name:iphone': 'YouTube'}], 'videoobject': [{'embedurl': 'https://www.youtube.com/embed/onfsTdy23DM', 'playertype': 'HTML5 Flash', 'isfamilyfriendly': 'True', 'uploaddate': '2017-10-13', 'videoid': 'onfsTdy23DM', 'url': 'https://www.youtube.com/watch?v=onfsTdy23DM', 'duration': 'PT3M30S', 'unlisted': 'False', 'name': 'Find Your Soul Mat: A Guide to All Manduka Yoga Mats', 'paid': 'False', 'width': '1280', 'regionsallowed': 'AD,AE,AF,AG,AI,AL,AM,AO,AQ,AR,AS,AT,AU,AW,AX,AZ,BA,BB,BD,BE,BF,BG,BH,BI,BJ,BL,BM,BN,BO,BQ,BR,BS,BT,BV,BW,BY,BZ,CA,CC,CD,CF,CG,CH,CI,CK,CL,CM,CN,CO,CR,CU,CV,CW,CX,CY,CZ,DE,DJ,DK,DM,DO,DZ,EC,EE,EG,EH...', 'genre': 'Travel & Events', 'interactioncount': '31229', 'channelid': 'UCJS7OZs6OSoFkgs2dGHIjWw', 'datepublished': '2017-10-13', 'thumbnailurl': 'https://i.ytimg.com/vi/onfsTdy23DM/maxresdefault.jpg', 'height': '720'}], 'cse_image': [{'src': 'https://i.ytimg.com/vi/onfsTdy23DM/maxresdefault.jpg'}]}",off,0.338409,1,[{'src': 'https://i.ytimg.com/vi/onfsTdy23DM/maxresdefault.jpg'}],"[{'src': 'https://encrypted-tbn3.gstatic.com/images?q=tbn:ANd9GcR8g97T9Lo7TZb0IaxLkOSW7AIVXgmw3npAwM8zoY7ejJfEr8mexJJuSZ8N', 'width': '300', 'height': '168'}]","[{'og:image': 'https://i.ytimg.com/vi/onfsTdy23DM/maxresdefault.jpg', 'twitter:app:url:iphone': 'vnd.youtube://www.youtube.com/watch?v=onfsTdy23DM&feature=applinks', 'twitter:app:id:googleplay': 'com.google.android.youtube', 'theme-color': '#ff0000', 'og:image:width': '1280', 'twitter:card': 'player', 'og:site_name': 'YouTube', 'twitter:url': 'https://www.youtube.com/watch?v=onfsTdy23DM', 'twitter:app:url:ipad': 'vnd.youtube://www.youtube.com/watch?v=onfsTdy23DM&feature=applinks', 'al:android:package': 'com.google.android.youtube', 'twitter:app:name:googleplay': 'YouTube', 'title': 'Find Your Soul Mat: A Guide to All Manduka Yoga Mats', 'al:ios:url': 'vnd.youtube://www.youtube.com/watch?v=onfsTdy23DM&feature=applinks', 'twitter:app:id:iphone': '544007664', 'al:ios:app_store_id': '544007664', 'twitter:image': 'https://i.ytimg.com/vi/onfsTdy23DM/maxresdefault.jpg', 'twitter:player': 'https://www.youtube.com/embed/onfsTdy23DM', 'twitter:player:height': '720', 'twitter:site': '@youtube', 'og:video:type': 'text/html', 'og:video:height': '720', 'og:video:url': 'https://www.youtube.com/embed/onfsTdy23DM', 'og:type': 'video.other', 'twitter:title': 'Find Your Soul Mat: A Guide to All Manduka Yoga Mats', 'al:ios:app_name': 'YouTube', 'og:title': 'Find Your Soul Mat: A Guide to All Manduka Yoga Mats', 'og:image:height': '720', 'twitter:app:id:ipad': '544007664', 'al:web:url': 'https://www.youtube.com/watch?v=onfsTdy23DM&feature=applinks', 'og:video:secure_url': 'https://www.youtube.com/embed/onfsTdy23DM', 'og:video:width': '1280', 'al:android:url': 'vnd.youtube://www.youtube.com/watch?v=onfsTdy23DM&feature=applinks', 'fb:app_id': '87741124305', 'twitter:app:url:googleplay': 'https://www.youtube.com/watch?v=onfsTdy23DM', 'twitter:app:name:ipad': 'YouTube', 'og:url': 'https://www.youtube.com/watch?v=onfsTdy23DM', 'twitter:player:width': '1280', 'al:android:app_name': 'YouTube', 'twitter:app:name:iphone': 'YouTube'}]",,"[{'width': '1280', 'url': 'https://i.ytimg.com/vi/onfsTdy23DM/maxresdefault.jpg', 'height': '720'}]","[{'url': 'http://www.youtube.com/user/MandukaTV'}, {'url': 'https://plus.google.com/105363871791261892724'}]","[{'embedurl': 'https://www.youtube.com/embed/onfsTdy23DM', 'playertype': 'HTML5 Flash', 'isfamilyfriendly': 'True', 'uploaddate': '2017-10-13', 'videoid': 'onfsTdy23DM', 'url': 'https://www.youtube.com/watch?v=onfsTdy23DM', 'duration': 'PT3M30S', 'unlisted': 'False', 'name': 'Find Your Soul Mat: A Guide to All Manduka Yoga Mats', 'paid': 'False', 'width': '1280', 'regionsallowed': 'AD,AE,AF,AG,AI,AL,AM,AO,AQ,AR,AS,AT,AU,AW,AX,AZ,BA,BB,BD,BE,BF,BG,BH,BI,BJ,BL,BM,BN,BO,BQ,BR,BS,BT,BV,BW,BY,BZ,CA,CC,CD,CF,CG,CH,CI,CK,CL,CM,CN,CO,CR,CU,CV,CW,CX,CY,CZ,DE,DJ,DK,DM,DO,DZ,EC,EE,EG,EH...', 'genre': 'Travel & Events', 'interactioncount': '31229', 'channelid': 'UCJS7OZs6OSoFkgs2dGHIjWw', 'datepublished': '2017-10-13', 'thumbnailurl': 'https://i.ytimg.com/vi/onfsTdy23DM/maxresdefault.jpg', 'height': '720'}]",,,,,,,,,,,,,,,,,,,,,,https://i.ytimg.com/vi/onfsTdy23DM/maxresdefault.jpg,Find Your Soul Mat: A Guide to All Manduka Yoga Mats,https://www.youtube.com/watch?v=onfsTdy23DM,Find Your Soul Mat: A Guide to All Manduka Yoga Mats,,,,YouTube,com.google.android.youtube,vnd.youtube://www.youtube.com/watch?v=onfsTdy23DM&feature=applinks,YouTube,544007664,vnd.youtube://www.youtube.com/watch?v=onfsTdy23DM&feature=applinks,https://www.youtube.com/watch?v=onfsTdy23DM&feature=applinks,87741124305,720,1280,YouTube,video.other,720,https://www.youtube.com/embed/onfsTdy23DM,text/html,https://www.youtube.com/embed/onfsTdy23DM,1280,#ff0000,com.google.android.youtube,544007664,544007664,YouTube,YouTube,YouTube,https://www.youtube.com/watch?v=onfsTdy23DM,vnd.youtube://www.youtube.com/watch?v=onfsTdy23DM&feature=applinks,vnd.youtube://www.youtube.com/watch?v=onfsTdy23DM&feature=applinks,player,https://i.ytimg.com/vi/onfsTdy23DM/maxresdefault.jpg,https://www.youtube.com/embed/onfsTdy23DM,720,1280,@youtube,Find Your Soul Mat: A Guide to All Manduka Yoga Mats,https://www.youtube.com/watch?v=onfsTdy23DM,,,,,,,,,,,,,,,,,,,,,,,,,,,,,,,,,,,,,,,,,,,,,,,,,,,,,,,,,,,,,,,,,,
